Datetime,Tweet Id,Text,Username,User Location,Reply Count,Retweet Count,Like Count,Quote Count,Date,compound,Month,Clean Tweet
2021-05-19 03:03:23+00:00,1.39485E+18,"Water issues in the city again?  SMH

#JacksonWaterCrisis",FNULNU1,,0,0,0,0,5/19/2021,-0.4648,5,water issues in the city again smh jacksonwatercrisis
2021-04-24 02:14:03+00:00,1.38578E+18,#JacksonWaterCrisis https://t.co/OFuCz2zYa9,Backstorymom1,,0,0,0,0,4/24/2021,0,4, jacksonwatercrisis 
2021-04-21 12:26:37+00:00,1.38485E+18,Anyone with mobile video of the #jacksonwatercrisis please reach out to mignonn@cbsnews.com.,nicolahann,"New York, NY",0,0,0,0,4/21/2021,0.34,4,anyone with mobile video of the jacksonwatercrisis please reach out to mignonn cbsnews com 
2021-04-07 21:13:26+00:00,1.37991E+18,#FlintWaterCrisis #JacksonWaterCrisis https://t.co/hSDH2MCkeS,JalenRoseBat,Imported from Detroit,0,0,0,0,4/7/2021,0,4, flintwatercrisis jacksonwatercrisis 
2021-03-22 23:57:03+00:00,1.37415E+18,"Jackson Mississippi's Water Crisis is Rooted in Racism https://t.co/ZIXFSjaB0e via @YouTube 
#StatusCoup #JacksonWaterCrisis",ru2inept,The Twilight Zone,0,3,0,0,3/22/2021,-0.8481,3,jackson mississippi s water crisis is rooted in racism via youtube statuscoup jacksonwatercrisis
2021-03-20 21:42:07+00:00,1.37339E+18,"Another secession from the union?!? 
#JacksonWaterCrisis 
Wait, what?!! https://t.co/wgnYefgbSb",Backstorymom1,,1,0,0,0,3/20/2021,0,3,another secession from the union jacksonwatercrisis wait what 
2021-03-17 23:22:22+00:00,1.37233E+18,@SenHydeSmith why the vague language in the bill to help the water crises in #JacksonWaterCrisis  ?,cindylang17,,0,0,0,0,3/17/2021,0.3182,3, senhydesmith why the vague language in the bill to help the water crises in jacksonwatercrisis 
2021-03-17 21:14:48+00:00,1.3723E+18,They still don‚Äôt have clean water from faucets in #Jackson #Mississippi??? And people are worried about the Queen of England? #JacksonWaterCrisis https://t.co/gRJn8DTrZV,ziskacomm,"Washington, DC",0,0,0,0,3/17/2021,0.3527,3,they still don t have clean water from faucets in jackson mississippi and people are worried about the queen of england jacksonwatercrisis 
2021-03-17 16:52:40+00:00,1.37223E+18,We must demand equitable access to water for #JacksonWaterCrisis https://t.co/TpMXB1BejR,MaSs20y8,"Connecticut, USA",0,0,1,0,3/17/2021,-0.128,3,we must demand equitable access to water for jacksonwatercrisis 
2021-03-17 15:33:10+00:00,1.37221E+18,This city has participatory budgeting as it approaches long neglected equity issues resulting from extractive policies by state government. Weaknesses of water infrastructure as well as health care exacerbated pandemic struggles. #JacksonWaterCrisis https://t.co/85hol6SiBB,odaraia,Salish Sea,0,0,0,0,3/17/2021,-0.4767,3,this city has participatory budgeting as it approaches long neglected equity issues resulting from extractive policies by state government weaknesses of water infrastructure as well as health care exacerbated pandemic struggles jacksonwatercrisis 
2021-03-17 14:53:01+00:00,1.3722E+18,"Access to water is a human right, it‚Äôs been 5 weeks since folx in Jackson had clean drinking water... Donate to the Mississippi Winter Storm Rapid Response here: https://t.co/T3kv6ZNzH6  #JacksonWaterCrisis #WhenRacismTrumpsDemocracy @RukiaLumumba @lumumbasvision https://t.co/gIIMR7acRu",reneechatcher,"Chicago, IL",0,7,6,0,3/17/2021,0.4019,3,access to water is a human right it s been  weeks since folx in jackson had clean drinking water donate to the mississippi winter storm rapid response here jacksonwatercrisis whenracismtrumpsdemocracy rukialumumba lumumbasvision 
2021-03-17 14:42:17+00:00,1.3722E+18,s/o to @ChokweALumumba for that interview on @democracynow this morning. it was the most detailed assessment of the limitations of Black electoral politics I‚Äôve heard in a while. #WhenRacismTrumpsDemocracy #JacksonWaterCrisis #RighttoWater,reneechatcher,"Chicago, IL",0,2,1,0,3/17/2021,0,3,s o to chokwealumumba for that interview on democracynow this morning it was the most detailed assessment of the limitations of black electoral politics i ve heard in a while whenracismtrumpsdemocracy jacksonwatercrisis righttowater
2021-03-17 13:30:49+00:00,1.37218E+18,@Backstorymom1 My God- where are their representatives? #JacksonWaterCrisis,KatrinaHagen2,CA,0,0,0,0,3/17/2021,0.2732,3,  my god where are their representatives jacksonwatercrisis
2021-03-17 12:24:29+00:00,1.37216E+18,Well water boil water notice was lifted here in Jackson after almost a month... but some businesses still closed because of it! Surface water still has boil water notice. #JacksonWaterCrisis https://t.co/Red6rCOwXS,Ginger_Zee,New York,4,9,39,0,3/17/2021,0.2124,3,well water boil water notice was lifted here in jackson after almost a month but some businesses still closed because of it surface water still has boil water notice jacksonwatercrisis 
2021-03-16 03:24:04+00:00,1.37166E+18,"L O U D E R üó£ 
Throw in #JacksonWaterCrisis 
M I S S I S S I P P I https://t.co/WFEFKCj59F",Backstorymom1,,0,7,5,0,3/16/2021,0.5766,3,l o u d e r throw in jacksonwatercrisis m i s s i s s i p p i 
2021-03-15 23:50:05+00:00,1.37161E+18,"@EPAwater why haven't full attention been given to #JacksonWaterCrisis? 
Jackson MS needs clean water.",da_minister13,"South Florida, USA",0,5,2,0,3/15/2021,0.4019,3, epawater why haven t full attention been given to jacksonwatercrisis jackson ms needs clean water 
2021-03-15 15:35:23+00:00,1.37149E+18,"Racial disparities run deep in the US, including access to disaster relief. America is a 1st world country, with third world problems. #WaterIsLife #JacksonWaterCrisis  https://t.co/ftnzFjZtNX",n_timmerman,"Edmond, OK",0,1,1,1,3/15/2021,-0.5719,3,racial disparities run deep in the us including access to disaster relief america is a  world country with third world problems waterislife jacksonwatercrisis 
2021-03-14 23:35:13+00:00,1.37124E+18,"@kay_suigeneris I agree with u, this is one heck of an article &amp; the opinion of the writer is right ..... Mississippi Goddam  ~ #JacksonWaterCrisis #Poverty #Racism",cupcake0804,,1,0,1,0,3/14/2021,-0.8555,3, kay suigeneris i agree with u this is one heck of an article amp the opinion of the writer is right mississippi goddam jacksonwatercrisis poverty racism
2021-03-13 20:39:05+00:00,1.37084E+18,"#JacksonWaterCrisis M I S S I S S I P P I

Next time, 'it will be worse': Jackson, Mississippi, water crisis is a warning, residents say https://t.co/0UqnWzKIiS",Backstorymom1,,0,1,0,0,3/13/2021,-0.8625,3, jacksonwatercrisis m i s s i s s i p p i next time it will be worse jackson mississippi water crisis is a warning residents say 
2021-03-13 16:24:34+00:00,1.37077E+18,"This is so infuriating!!!! #JacksonWaterCrisis 
#JACKSON #MISSISSIPPI https://t.co/LXYthtYjWe",Monicadisaster1,"Pennsylvania, USA",0,0,0,0,3/13/2021,-0.7604,3,this is so infuriating jacksonwatercrisis jackson mississippi 
2021-03-12 21:12:00+00:00,1.37048E+18,"Mississippi's capital city enters week 4 of a water crisis: Here's how it got to this point.

Read More: https://t.co/kZ6xF6dDbV
#JxnNeedsWater #JacksonWaterCrisis #WaterCrisis",Civilgeo,"Wisconsin, USA",0,0,0,0,3/12/2021,-0.6249,3,mississippi s capital city enters week  of a water crisis here s how it got to this point read more jxnneedswater jacksonwatercrisis watercrisis
2021-03-12 20:51:32+00:00,1.37048E+18,Week 4?!!! #MSWaterCrisis #JacksonWaterCrisis @EPA @VP @congressdotgov https://t.co/hJq8CUIDCN,BonnieSalm,"Chicago, IL",0,4,3,0,3/12/2021,0,3,week  mswatercrisis jacksonwatercrisis epa vp congressdotgov 
2021-03-12 20:49:45+00:00,1.37048E+18,"these people don‚Äôt even have the most basic necessity and roughly 1/2 of our elected officials are chaotically spreading false info about potatoes and children‚Äôs books. Something  is really, really broken.  HELP #JacksonWaterCrisis https://t.co/FFVewegFab",upfrontfanatic,Midwest ,0,0,0,0,3/12/2021,0.0782,3,these people don t even have the most basic necessity and roughly   of our elected officials are chaotically spreading false info about potatoes and children s books something is really really broken help jacksonwatercrisis 
2021-03-12 19:47:50+00:00,1.37046E+18,"L O U D E R üó£ 
#BuriedLede 
#JacksonWaterCrisis https://t.co/AiV6Gw7a3a",Backstorymom1,,0,0,0,0,3/12/2021,0.5766,3,l o u d e r buriedlede jacksonwatercrisis 
2021-03-11 18:47:18+00:00,1.37008E+18,@annaonair12 Enjoy your #SpringBreak vacation! Great job reporting @WJTV #jacksonwatercrisis üö∞,auditwalk24,,0,0,0,0,3/11/2021,0.8221,3,  enjoy your springbreak vacation great job reporting wjtv jacksonwatercrisis 
2021-03-10 20:10:26+00:00,1.36974E+18,@wwreserve #JacksonWaterCrisis,Monicadisaster1,"Pennsylvania, USA",0,0,0,0,3/10/2021,0,3, wwreserve jacksonwatercrisis
2021-03-10 20:10:10+00:00,1.36974E+18,#JacksonWaterCrisis #Mississippi https://t.co/ZieOVt6QG1,Monicadisaster1,"Pennsylvania, USA",0,1,0,0,3/10/2021,0,3, jacksonwatercrisis mississippi 
2021-03-09 21:25:00+00:00,1.3694E+18,"Mississippi Water Crisis Highlights Infrastructure Problems

Many residents of Jackson, Miss., remain without running water three weeks after a winter storm hit the city.

Read more: https://t.co/vz2jxgRlcg
#JxnNeedsWater #JacksonWaterCrisis #WaterCrisis",Civilgeo,"Wisconsin, USA",0,1,0,2,3/9/2021,-0.8126,3,mississippi water crisis highlights infrastructure problems many residents of jackson miss remain without running water three weeks after a winter storm hit the city read more jxnneedswater jacksonwatercrisis watercrisis
2021-03-09 20:14:03+00:00,1.36938E+18,"L O U D E R üó£ 
#JacksonWaterCrisis https://t.co/WNadPu4F23",Backstorymom1,,1,1,1,0,3/9/2021,0.5766,3,l o u d e r jacksonwatercrisis 
2021-03-07 15:19:06+00:00,1.36858E+18,"Black elected Democrats are either corrupt or incompetent. Stop blaming whites for their inability to get things done. 
#JacksonMS #Democrats @NBCNews #JacksonWaterCrisis #DemocratsAreDestroyingAmerica #Biden #Trump 
https://t.co/54YXOGAOdQ",CheeseheadBrian,"Wisconsin, USA",0,0,0,0,3/7/2021,-0.8807,3,black elected democrats are either corrupt or incompetent stop blaming whites for their inability to get things done jacksonms democrats nbcnews jacksonwatercrisis democratsaredestroyingamerica biden trump 
2021-03-07 10:53:34+00:00,1.36852E+18,Jackson Ms is the new Flint.. #jacksonwatercrisis,Ronmc84516182,,0,0,2,0,3/7/2021,0,3,jackson ms is the new flint jacksonwatercrisis
2021-03-07 00:00:58+00:00,1.36835E+18,"The #JacksonWaterCrisis is happening in the blackest city, in the blackest state in our nation. Donate below to expedite funds to @lumumbasvision who is working tirelessly to assist the people of Jackson.

#JxnNeedsWater #BlackLivesMatter @ChokweALumumba 

https://t.co/cHWwUq9wBl",QuinlanAndCo,"Pennsylvania, USA",1,7,4,0,3/7/2021,0,3,the jacksonwatercrisis is happening in the blackest city in the blackest state in our nation donate below to expedite funds to lumumbasvision who is working tirelessly to assist the people of jackson jxnneedswater blacklivesmatter chokwealumumba 
2021-03-06 15:00:14+00:00,1.36821E+18,"While Jackson residents and organizers say they understand the historical nature of the water system's disrepair, city and other Mississippi government leaders also need to plan ahead to prevent this from ever happening again. #JacksonWaterCrisis

https://t.co/6LGNBhlIxt",newsone,"New York, NY",1,4,12,0,3/6/2021,0.0258,3,while jackson residents and organizers say they understand the historical nature of the water system s disrepair city and other mississippi government leaders also need to plan ahead to prevent this from ever happening again jacksonwatercrisis 
2021-03-06 14:38:16+00:00,1.36821E+18,What are we doing to help these folks? No water for *11* days?! During a damn pandemic? This is a national disgrace. @NBCNews @cnnbrk @MSNBC @maddow #JacksonWaterCrisis @SenBobCasey @SenToomey @RepScottPerry @POTUS @GovernorTomWolf @fema https://t.co/lgpy6Gk32y,RAnselmo_Jordan,,1,0,0,0,3/6/2021,-0.7377,3,what are we doing to help these folks no water for  days during a damn pandemic this is a national disgrace nbcnews cnnbrk msnbc maddow jacksonwatercrisis senbobcasey sentoomey repscottperry potus governortomwolf fema 
2021-03-06 02:05:10+00:00,1.36802E+18,"Could water service be restored in Jackson, Mississippi? #JacksonWaterCrisis. https://t.co/EiktqtRUJA",TheTornadoNews,"Orange, NJ",0,0,0,0,3/6/2021,0.34,3,could water service be restored in jackson mississippi jacksonwatercrisis 
2021-03-06 01:03:49+00:00,1.368E+18,"#JacksonWaterCrisis 

Need help? Want to help? 

 https://t.co/9Af7azfL4N",johnwbateman,"Starkville, MS",0,0,0,0,3/6/2021,0.7236,3, jacksonwatercrisis need help want to help 
2021-03-05 15:56:49+00:00,1.36787E+18,"First national coverage that I have seen about this. Been saying for a while that the #JacksonWaterCrisis water situation is on par/worse than Flint (and like Flint Jackson gets ignored because it's a black city) 

#FBA #B1 #NoAntiBlackRacism #Mississippi

https://t.co/bOxePCkdGd",RacistOTW,Exposing someone,1,0,0,0,3/5/2021,0.0516,3,first national coverage that i have seen about this been saying for a while that the jacksonwatercrisis water situation is on par worse than flint and like flint jackson gets ignored because it s a black city fba  noantiblackracism mississippi 
2021-03-05 13:55:24+00:00,1.36784E+18,Also special thank you to the people who contributed to donations! We raised $100 towards potable water for Jackson residents! #JacksonWaterCrisis,LifestyleKris,"Mississippi, USA",1,0,0,0,3/5/2021,0.6988,3,also special thank you to the people who contributed to donations we raised  towards potable water for jackson residents jacksonwatercrisis
2021-03-05 01:58:32+00:00,1.36766E+18,"A closer look at the water crisis in Jackson, Mississippi. #JacksonWaterCrisis. https://t.co/CCBK6LVEvR",TheTornadoNews,"Orange, NJ",0,1,1,0,3/5/2021,-0.6249,3,a closer look at the water crisis in jackson mississippi jacksonwatercrisis 
2021-03-05 00:01:10+00:00,1.36763E+18,"17 days and counting without potable water in Jackson's predominantly Black neighborhoods. White state government officials claim its not their problem. This is systemic racism folks. Read this story and you will understand.

#JacksonWaterCrisis

https://t.co/HtzgkzczHM",dustinfalgout,"Biloxi, Ms",4,51,58,6,3/5/2021,-0.4295,3, days and counting without potable water in jackson s predominantly black neighborhoods white state government officials claim its not their problem this is systemic racism folks read this story and you will understand jacksonwatercrisis 
2021-03-04 22:11:20+00:00,1.3676E+18,"130-180 billion dollars. That‚Äôs bill for the #TexasBlackout (higher figure includes neighboring states). Tally is increasing by the hour, with water issues in #JacksonWaterCrisis. That makes it the most expensive climate shock in the US. By a factor of 10 from number 2.",Uptheleft,"New Haven, CT",0,0,0,0,3/4/2021,-0.3744,3,  billion dollars that s bill for the texasblackout higher figure includes neighboring states tally is increasing by the hour with water issues in jacksonwatercrisis that makes it the most expensive climate shock in the us by a factor of  from number  
2021-03-04 21:08:20+00:00,1.36758E+18,@HindsEOC #JacksonWaterCrisis,Monicadisaster1,"Pennsylvania, USA",0,0,0,0,3/4/2021,0,3, hindseoc jacksonwatercrisis
2021-03-04 16:51:32+00:00,1.36752E+18,"#JacksonWaterCrisis #Mississippi 
#JACKSON  üíôüíß #DAT https://t.co/J5gbfUE7LI",Monicadisaster1,"Pennsylvania, USA",0,4,3,0,3/4/2021,0.6369,3, jacksonwatercrisis mississippi jackson dat 
2021-03-04 03:53:57+00:00,1.36732E+18,"How does Jackson not have water for 2 weeks and it's not a bigger story? How was this information not wider spread?
 #JacksonWaterCrisis",nana991498,NY,0,1,1,0,3/4/2021,0,3,how does jackson not have water for  weeks and it s not a bigger story how was this information not wider spread jacksonwatercrisis
2021-03-04 03:48:00+00:00,1.36732E+18,@adriawalkr @Dr_Smart_B And has continued to cover for the past two days-tonight interviewed the mayor of Jackson #maddow #JacksonWaterCrisis,AnnaBonanz,"Playa del Rey, Los Angeles",0,0,2,0,3/4/2021,0,3, adriawalkr dr smart b and has continued to cover for the past two days tonight interviewed the mayor of jackson maddow jacksonwatercrisis
2021-03-04 03:27:40+00:00,1.36732E+18,"How many folks in Jackson are still without water? 
#JacksonWaterCrisis https://t.co/p6KiGE14EV",johnwbateman,"Starkville, MS",0,0,1,1,3/4/2021,0,3,how many folks in jackson are still without water jacksonwatercrisis 
2021-03-04 02:56:30+00:00,1.36731E+18,"I am horrified about the water disaster in Jackson, MS. But hearing Jackson‚Äôs mayor on NPR and then seeing him on Rachel, well, I‚Äôll do whatever I can to help the city and I look forward to more sightings. #JacksonWaterCrisis",lauramkeane,"St. Petersburg, FL",0,0,0,0,3/4/2021,0.34,3,i am horrified about the water disaster in jackson ms but hearing jackson s mayor on npr and then seeing him on rachel well i ll do whatever i can to help the city and i look forward to more sightings jacksonwatercrisis
2021-03-04 02:54:07+00:00,1.36731E+18,"What are some orgs who are on the ground helping with the #JacksonWaterCrisis? Our team will try to get some donations flowing. 

@ChokweALumumba @BennieGThompson @BGThompsonMS",heyyergs,"Pennsylvania, USA",0,1,2,0,3/4/2021,0.296,3,what are some orgs who are on the ground helping with the jacksonwatercrisis our team will try to get some donations flowing chokwealumumba benniegthompson bgthompsonms
2021-03-04 02:52:10+00:00,1.36731E+18,"Jackson, Mississippi #watercrisis rages on. Speaking with @SenBrianSchatz @SenWhitehouse staff today about direct community investment for climate change solutions. Like #Flint #JacksonWaterCrisis needs water infrastructure to be resilient. https://t.co/w51AfO1Sra via @nbcnews",MXLDET,detroit mi,0,0,0,0,3/4/2021,0.0258,3,jackson mississippi watercrisis rages on speaking with senbrianschatz senwhitehouse staff today about direct community investment for climate change solutions like flint jacksonwatercrisis needs water infrastructure to be resilient via nbcnews
2021-03-04 02:49:35+00:00,1.36731E+18,#JacksonMississippi doesn't even have water to wash their hands during a #pandemic!  Don't let the story die until they get potable water. #JacksonWaterCrisis https://t.co/I5xjqJObfD,shelfemployed,USA,0,0,0,0,3/4/2021,-0.636,3, jacksonmississippi doesn t even have water to wash their hands during a pandemic don t let the story die until they get potable water jacksonwatercrisis 
2021-03-04 02:48:26+00:00,1.36731E+18,"#maddow 

Infrastructure and utilities in the country are a sad and sorry disgrace! What century is this?

#JacksonWaterCrisis #TexasFreeze @senatedems @VP @housedemocrats",Informed_Un,Earth,0,0,0,0,3/4/2021,-0.784,3, maddow infrastructure and utilities in the country are a sad and sorry disgrace what century is this jacksonwatercrisis texasfreeze senatedems vp housedemocrats
2021-03-04 02:47:15+00:00,1.36731E+18,#JacksonWaterCrisis #texaswatercrisis #RepublicansAreTheProblem #drsuess,Knowletup,"New York,NY",0,0,0,0,3/4/2021,0,3, jacksonwatercrisis texaswatercrisis republicansaretheproblem drsuess
2021-03-04 01:48:54+00:00,1.36729E+18,@TheView  @sunny  Like the #gop has said repeatedly we have to stop bailing out failed blue states like #JacksonWaterCrisis  #Mississippi #MAGA #trump why are they asking for money now?,daniel3001944,,0,0,0,0,3/4/2021,0.3182,3, theview sunny like the gop has said repeatedly we have to stop bailing out failed blue states like jacksonwatercrisis mississippi maga trump why are they asking for money now 
2021-03-04 01:27:15+00:00,1.36729E+18,"Jackson, Mississippi has been without running water for weeks. #JacksonWaterCrisis           https://t.co/JqIpJOZAH2",TheTornadoNews,"Orange, NJ",0,0,0,0,3/4/2021,0,3,jackson mississippi has been without running water for weeks jacksonwatercrisis 
2021-03-04 01:14:07+00:00,1.36728E+18,Having running water would be pretty neat! #JacksonWaterCrisis #JacksonMS,k_benz_,,0,0,2,0,3/4/2021,0.7574,3,having running water would be pretty neat jacksonwatercrisis jacksonms
2021-03-04 01:05:33+00:00,1.36728E+18,"#waterbill üíßüí∏

#AustinWater 
#JacksonWaterCrisis 
#water 
#utilities https://t.co/eUPaTcfMnY",Monicadisaster1,"Pennsylvania, USA",0,0,0,0,3/4/2021,0,3, waterbill austinwater jacksonwatercrisis water utilities 
2021-03-03 23:39:44+00:00,1.36726E+18,#JacksonWaterCrisis #JacksonNeedsWater https://t.co/FfNi1uto65,dmom2124,,0,0,2,0,3/3/2021,0,3, jacksonwatercrisis jacksonneedswater 
2021-03-03 23:09:51+00:00,1.36725E+18,"@tatereeves Residents in your Capitol city have been without running water for 2 weeks and counting.

You're right. Mississippians don't need handlers. They need competent governance, something they've sorely lacked forever.

#JacksonWaterCrisis",Brosephus4,Wakanda. Forever,0,12,77,0,3/3/2021,0.3182,3, tatereeves residents in your capitol city have been without running water for  weeks and counting you re right mississippians don t need handlers they need competent governance something they ve sorely lacked forever jacksonwatercrisis
2021-03-03 22:05:04+00:00,1.36723E+18,"In case you were unaware, Jackson, Mississippi is in a water crisis. Jackson residents are primarily African American. #blacklivesmatter #institutionalracism #Jacksonwatercrisis https://t.co/KJDSGIKEMb",LiberalResist,"San Francisco, CA",0,4,3,0,3/3/2021,-0.7096,3,in case you were unaware jackson mississippi is in a water crisis jackson residents are primarily african american blacklivesmatter institutionalracism jacksonwatercrisis 
2021-03-03 20:05:48+00:00,1.3672E+18,"@fubarrdog @JasonKander Tell the people of Jackson, Mississippi how great their running water is. #JacksonWaterCrisis",elisedowner,"Blue City, Red State, USA",0,0,16,0,3/3/2021,0.6249,3, fubarrdog jasonkander tell the people of jackson mississippi how great their running water is jacksonwatercrisis
2021-03-03 19:20:15+00:00,1.36719E+18,"Jackson, Mississippi deserves clean water. #JacksonWaterCrisis https://t.co/3rOpMqnIwh",lmauricecpr,Improving Communities ,0,9,13,0,3/3/2021,0.4019,3,jackson mississippi deserves clean water jacksonwatercrisis 
2021-03-03 18:34:10+00:00,1.36718E+18,"Jackson, Mississippi is being ignored because the city is 79.4% Black. #JacksonWaterCrisis",lmauricecpr,Improving Communities ,11,74,128,5,3/3/2021,-0.3182,3,jackson mississippi is being ignored because the city is   black jacksonwatercrisis
2021-03-03 17:36:43+00:00,1.36717E+18,"Moss Point Drop Off Location for water: 4600 Payne St, Moss Point MS 39563 #JacksonWaterCrisis https://t.co/ZIbrGEhOfa",LifestyleKris,"Mississippi, USA",1,1,0,0,3/3/2021,-0.2732,3,moss point drop off location for water  payne st moss point ms  jacksonwatercrisis 
2021-03-03 17:10:31+00:00,1.36716E+18,"Ever heard of the #FlintWaterCrisis of Flint, Michigan -- @LittleMissFlint reported on the city's water crisis that waged war against residents for HALF A DECADE!

I just hope that it does not take the same amount of time to remedy the #JacksonWaterCrisis that it took Flint. https://t.co/VNX9llyfCb",JusMott,"Boston, New York, DC",0,0,0,0,3/3/2021,-0.75,3,ever heard of the flintwatercrisis of flint michigan littlemissflint reported on the city s water crisis that waged war against residents for half a decade i just hope that it does not take the same amount of time to remedy the jacksonwatercrisis that it took flint 
2021-03-03 16:04:23+00:00,1.36714E+18,#WaterOutage #Flint #JacksonWaterCrisis üíßüíßüíß https://t.co/DEClXSXAOd,queenalwayz,"Detroit, MI",0,0,0,0,3/3/2021,0,3, wateroutage flint jacksonwatercrisis 
2021-03-03 15:58:41+00:00,1.36714E+18,Passed a Uhaul rental pickup towing several tanks of water on the way to work this morning because @tatereeves would rather create new problems than solve old ones. #JacksonWaterCrisis,geoffdua,"Jackson, MS",0,1,1,0,3/3/2021,0.0516,3,passed a uhaul rental pickup towing several tanks of water on the way to work this morning because tatereeves would rather create new problems than solve old ones jacksonwatercrisis
2021-03-03 15:32:13+00:00,1.36714E+18,"#JacksonWaterCrisis 
(4 weeks ago)

https://t.co/MHpJmrsOPK",Backstorymom1,,0,0,0,0,3/3/2021,0,3, jacksonwatercrisis  weeks ago 
2021-03-03 15:30:58+00:00,1.36714E+18,"#JacksonWaterCrisis 

Thousands of Jackson residents enter third week without running water https://t.co/e8vXVI5pWF",Backstorymom1,,0,0,0,0,3/3/2021,0,3, jacksonwatercrisis thousands of jackson residents enter third week without running water 
2021-03-03 15:26:20+00:00,1.36713E+18,"#JacksonWaterCrisis

Jackson, Mississippi, water crisis brings to light long-standing problems in city https://t.co/euNtEXT1jc",Backstorymom1,,0,0,1,0,3/3/2021,-0.7783,3, jacksonwatercrisis jackson mississippi water crisis brings to light long standing problems in city 
2021-03-03 14:48:03+00:00,1.36712E+18,"Jackson, Mississippi doesn't know when its residents will have available safe drinking water. This is an incompetent government. Unacceptable. People we gotta rally water is a basic need for life.
#JacksonWaterCrisis

https://t.co/hbf49pSiFC",kcResister,"Florida, USA",0,2,1,0,3/3/2021,-0.4939,3,jackson mississippi doesn t know when its residents will have available safe drinking water this is an incompetent government unacceptable people we gotta rally water is a basic need for life jacksonwatercrisis 
2021-03-03 13:21:37+00:00,1.3671E+18,"Three weeks. 

Half the people in their own state capital have been without clean water for over 3 weeks, in the middle of a pandemic, but their governor decides the important thing is to lift COVID restrictions like everything‚Äôs fine. ü§¨ü§¨ü§¨ #JacksonWaterCrisis",lbrass3,"Maryland, USA",0,4,4,0,3/3/2021,0.7202,3,three weeks half the people in their own state capital have been without clean water for over  weeks in the middle of a pandemic but their governor decides the important thing is to lift covid restrictions like everything s fine jacksonwatercrisis
2021-03-03 12:57:52+00:00,1.3671E+18,"Another banner day for racism in America: AZ/GA #votersuppression, #JacksonWaterCrisis, #NeeraTanden nixed, U Texas alumni tell black athletes to leave, and of course #MinimumWage still at a disgraceful $7.25.",BrockGaneles,,0,0,1,0,3/3/2021,-0.6486,3,another banner day for racism in america az ga votersuppression jacksonwatercrisis neeratanden nixed u texas alumni tell black athletes to leave and of course minimumwage still at a disgraceful   
2021-03-03 12:13:21+00:00,1.36709E+18,They love blaming the mayor but havent booked the governor who hasn't been doing anything üòíüòíüòíüòí #JacksonWaterCrisis,nj7174_jones,The South ,0,0,0,0,3/3/2021,0.128,3,they love blaming the mayor but havent booked the governor who hasn t been doing anything jacksonwatercrisis
2021-03-03 07:24:33+00:00,1.36701E+18,The #JacksonWaterCrisis in Mississippi is tantamount to a failed state. No human population should be w/o access to clean running water. More &amp; more US cities continue to lose basic necessities; we must reinvest in US infrastructure before our systems fully collapse. #WaterIsLife https://t.co/KG1mMFf2jk,Ryan_Deitsch,"Parkland, FL",0,11,20,0,3/3/2021,-0.8399,3,the jacksonwatercrisis in mississippi is tantamount to a failed state no human population should be w o access to clean running water more amp more us cities continue to lose basic necessities we must reinvest in us infrastructure before our systems fully collapse waterislife 
2021-03-03 06:16:19+00:00,1.367E+18,"wtf people are like 70% water, we need it to survive. This isn't ok. #JacksonWaterCrisis https://t.co/AaDwVyL75c",this1wierdgirl,"Somewhere Over Here, I think",0,0,0,0,3/3/2021,-0.3182,3,wtf people are like  water we need it to survive this isn t ok jacksonwatercrisis 
2021-03-03 06:06:18+00:00,1.36699E+18,One thing about the #JacksonWaterCrisis is poor Byram fought not be incorporated for years for this very reason. Now their water service sucks too.,dogsmycopilot,"Jackson, Mississippi",0,0,0,0,3/3/2021,-0.7845,3,one thing about the jacksonwatercrisis is poor byram fought not be incorporated for years for this very reason now their water service sucks too 
2021-03-03 06:03:18+00:00,1.36699E+18,"@GeorgeTakei #JacksonWaterCrisis 
https://t.co/Zmoclw8jQe",msvespa,"Los Angeles, CA",1,1,2,0,3/3/2021,0,3, georgetakei jacksonwatercrisis 
2021-03-03 05:00:47+00:00,1.36698E+18,"Classic red herring with lifting the mandate. üò∑ Don‚Äôt forget folks in TX and MS are still struggling with power, water, and electric bills...among other things like legislators in many states working to restrict voting access. Ah well...carry on üíÅüèΩ‚Äç‚ôÄÔ∏è #Abbott #JacksonWaterCrisis",drdnwd,"Memphis, TN",0,0,1,0,3/3/2021,0.3885,3,classic red herring with lifting the mandate don t forget folks in tx and ms are still struggling with power water and electric bills among other things like legislators in many states working to restrict voting access ah well carry on abbott jacksonwatercrisis
2021-03-03 04:54:29+00:00,1.36698E+18,"Water distribution üíß
#JACKSON #MISSISSIPPI 

#JacksonWaterCrisis #DAT https://t.co/wGwsCxmeJQ",Monicadisaster1,"Pennsylvania, USA",0,21,18,0,3/3/2021,0,3,water distribution jackson mississippi jacksonwatercrisis dat 
2021-03-03 04:26:27+00:00,1.36697E+18,#JacksonWaterCrisis #JacksonMS https://t.co/476rv3YxDV,Beasley811,Na,0,0,0,0,3/3/2021,0,3, jacksonwatercrisis jacksonms 
2021-03-03 02:58:25+00:00,1.36695E+18,"@GeorgeTakei @BlueMark55 #JacksonWaterCrisis 
https://t.co/Zmoclw8jQe",msvespa,"Los Angeles, CA",0,2,4,0,3/3/2021,0,3, georgetakei  jacksonwatercrisis 
2021-03-03 02:48:44+00:00,1.36694E+18,"In Jackson, Mississippi, some residents have been without water going on two weeks - CNN

#JacksonWaterCrisis  https://t.co/af1tqanO4W",Resistance411,United States,0,1,0,0,3/3/2021,0,3,in jackson mississippi some residents have been without water going on two weeks cnn jacksonwatercrisis 
2021-03-03 02:45:36+00:00,1.36694E+18,"@GeorgeTakei #JacksonWaterCrisis on #TheReidOut 
https://t.co/42qxgBIyFz",msvespa,"Los Angeles, CA",0,3,4,0,3/3/2021,0,3, georgetakei jacksonwatercrisis on thereidout 
2021-03-03 02:44:02+00:00,1.36694E+18,"Here's #TheReidOut on #JacksonWaterCrisis
https://t.co/42qxgBIyFz",msvespa,"Los Angeles, CA",0,0,3,0,3/3/2021,0,3,here s thereidout on jacksonwatercrisis 
2021-03-03 02:40:19+00:00,1.36694E+18,"#TheReidOut #JacksonWaterCrisis
https://t.co/42qxgBIyFz https://t.co/1H29v4cyST",msvespa,"Los Angeles, CA",0,1,3,0,3/3/2021,0,3, thereidout jacksonwatercrisis 
2021-03-03 02:36:43+00:00,1.36694E+18,#JacksonWaterCrisis #JacksonMSWaterCrisis https://t.co/S25GM786id,HeadedToTherapy,,0,0,0,0,3/3/2021,0,3, jacksonwatercrisis jacksonmswatercrisis 
2021-03-03 02:35:47+00:00,1.36694E+18,"What's happening in Jackson is chilling. 
#JacksonWaterCrisis #Mississippi https://t.co/DPvCTG0MST",Kimshasa,Chicago,0,0,0,0,3/3/2021,-0.0258,3,what s happening in jackson is chilling jacksonwatercrisis mississippi 
2021-03-03 02:34:06+00:00,1.36694E+18,@ImSpeaking13 Disgusted #JacksonWaterCrisis #JacksonMSWaterCrisis,HeadedToTherapy,,0,0,0,0,3/3/2021,-0.5267,3,  disgusted jacksonwatercrisis jacksonmswatercrisis
2021-03-03 01:12:25+00:00,1.36692E+18,@POTUS @VP @mishacollins why isn't anyone talking about Jackson Mississippi being without water?? #JacksonWaterCrisis,unsilent_stephy,Nevada,0,0,1,0,3/3/2021,0,3, potus vp mishacollins why isn t anyone talking about jackson mississippi being without water jacksonwatercrisis
2021-03-03 01:11:30+00:00,1.36692E+18,@bjsburner @GoodKidDadCity @vladduthiersCBS @celebrityhottub @CBSNews @JanetShamlian Thank you; this city is 82% Black. #WhiteFlight #JacksonWaterCrisis #JacksonMSWaterCrisis,HeadedToTherapy,,0,0,1,0,3/3/2021,0.3612,3, bjsburner goodkiddadcity vladduthierscbs celebrityhottub cbsnews janetshamlian thank you this city is  black whiteflight jacksonwatercrisis jacksonmswatercrisis
2021-03-03 01:07:52+00:00,1.36692E+18,82% Black üí° #JacksonWaterCrisis #JacksonMSWaterCrisis https://t.co/yVSMsHkdEd,HeadedToTherapy,,0,0,0,0,3/3/2021,0,3, black jacksonwatercrisis jacksonmswatercrisis 
2021-03-02 19:48:27+00:00,1.36684E+18,"#JacksonWaterCrisis #JacksonMississippi üôèüèæ
Join me in supporting People's Advocacy Institute via @actblue https://t.co/8tPOmLXVl3",AnitaFayeSlater,"Alabama, USA",0,1,3,0,3/2/2021,0.6249,3, jacksonwatercrisis jacksonmississippi join me in supporting people s advocacy institute via actblue 
2021-03-02 18:55:35+00:00,1.36682E+18,The ease of my commute between worlds says a lot about spending and meaningful care #JacksonWaterCrisis https://t.co/QEBHAQua5C,geoffdua,"Jackson, MS",0,1,1,0,3/2/2021,0.7906,3,the ease of my commute between worlds says a lot about spending and meaningful care jacksonwatercrisis 
2021-03-02 16:59:13+00:00,1.3668E+18,"#WATER #JACKSON #MISSISSIPPI üíß
TODAY

#JacksonWaterCrisis #DAT https://t.co/0ZeRURx0bo",Monicadisaster1,"Pennsylvania, USA",0,4,2,0,3/2/2021,0,3, water jackson mississippi today jacksonwatercrisis dat 
2021-03-02 16:55:59+00:00,1.36679E+18,#JACKSON #MISSISSIPPI #JacksonWaterCrisis https://t.co/e3D7CMF7zQ,Monicadisaster1,"Pennsylvania, USA",0,0,1,0,3/2/2021,0,3, jackson mississippi jacksonwatercrisis 
2021-03-02 16:26:13+00:00,1.36679E+18,@abcnews @wolfblitzer @DanRather @CBSNews #JacksonWaterCrisis https://t.co/2DO68CCwXf,NotOneMoreBlock,Lenape land,0,0,0,0,3/2/2021,0,3, abcnews wolfblitzer danrather cbsnews jacksonwatercrisis 
2021-03-02 15:33:49+00:00,1.36677E+18,"üôèPLEASE SHAREüôè #JacksonWaterCrisis 

@tatereeves What is the plan for getting clean water and emergency supplies to folks in #Jackson? We are nothing if we cannot meet our state residents' most basic needs. 

Non-MS folks, please RT to spread awareness! https://t.co/Ny3ki0wiVs",chilton125,,0,6,5,0,3/2/2021,0.6833,3, please share jacksonwatercrisis tatereeves what is the plan for getting clean water and emergency supplies to folks in jackson we are nothing if we cannot meet our state residents most basic needs non ms folks please rt to spread awareness 
2021-03-02 15:10:29+00:00,1.36677E+18,#jacksonwatercrisis @TheDemocrats @JenGranholm @epa @HHSGov #JacksonMS https://t.co/42yyctjDeL,archeradaire,Sirius A,0,0,0,0,3/2/2021,0,3, jacksonwatercrisis thedemocrats jengranholm epa hhsgov jacksonms 
2021-03-02 14:03:43+00:00,1.36675E+18,"Good morning! May I have a quick RT to help bring awareness to the residents of the city of #JacksonMS, who are on day 12 without running water! Thank you! #JacksonWaterCrisis #JacksonMSWaterCrisis @MatthewACherry @thereidout @dionnewarwick @jemelehill @cnn @CBSNews @NBCNews",HeadedToTherapy,,0,0,0,0,3/2/2021,0.656,3,good morning may i have a quick rt to help bring awareness to the residents of the city of jacksonms who are on day  without running water thank you jacksonwatercrisis jacksonmswatercrisis matthewacherry thereidout dionnewarwick jemelehill cnn cbsnews nbcnews
2021-03-02 13:59:07+00:00,1.36675E+18,"Good morning! May I have a quick RT to help bring awareness to the residents of the city of #JacksonMS, who are on day 12 without running water! Thank you! #JacksonWaterCrisis #JacksonMSWaterCrisis
 @TheJessieWoo @blckgirlbrunch @DeionSanders @itsgabrielleu @rolandsmartin",HeadedToTherapy,,0,0,0,0,3/2/2021,0.656,3,good morning may i have a quick rt to help bring awareness to the residents of the city of jacksonms who are on day  without running water thank you jacksonwatercrisis jacksonmswatercrisis thejessiewoo blckgirlbrunch deionsanders itsgabrielleu rolandsmartin
2021-03-02 13:34:42+00:00,1.36674E+18,"@11tulips Waterless in Jackson, MS ... Well, not me but their citizens are - and for the 12th day in a row. #JacksonWaterCrisis #JacksonMSWaterCrisis",HeadedToTherapy,,1,0,1,0,3/2/2021,0.1406,3,  waterless in jackson ms well not me but their citizens are and for the  day in a row jacksonwatercrisis jacksonmswatercrisis
2021-03-02 13:32:24+00:00,1.36674E+18,"Good morning x 12 to the residents of Jackson, MS. One for each day they've been without running water. #JacksonWaterCrisis #JacksonMSWaterCrisis",HeadedToTherapy,,0,0,1,0,3/2/2021,0.4404,3,good morning x  to the residents of jackson ms one for each day they ve been without running water jacksonwatercrisis jacksonmswatercrisis
2021-03-02 12:13:33+00:00,1.36672E+18,"#jacksonmississippi can‚Äôt get clean water in it‚Äôs predominantly black town, but as a country we can welcome back in non documented immigrants who get the coffers opened to them without any questions asked. #JacksonWaterCrisis",BeardedMan1975,"Baltimore, MD",1,1,1,0,3/2/2021,0.705,3, jacksonmississippi can t get clean water in it s predominantly black town but as a country we can welcome back in non documented immigrants who get the coffers opened to them without any questions asked jacksonwatercrisis
2021-03-02 11:29:28+00:00,1.36671E+18,@jxncat #JacksonWaterCrisis,snarky_op,"North Logan, UT",0,0,0,0,3/2/2021,0,3, jxncat jacksonwatercrisis
2021-03-02 00:49:06+00:00,1.36655E+18,"@vladduthiersCBS @chrislhayes @CBSNews @JanetShamlian #JacksonWaterCrisis 
#FlintWaterCrisis",CMCD048,"Illinois, USA",0,1,0,0,3/2/2021,0,3, vladduthierscbs chrislhayes cbsnews janetshamlian jacksonwatercrisis flintwatercrisis
2021-03-02 00:04:13+00:00,1.36654E+18,.@NorahODonnell: Thank you for covering the #JacksonWaterCrisis. .@CBSNews https://t.co/OIzOGSrPV9,kojman1,,0,0,0,0,3/2/2021,0.3612,3, norahodonnell thank you for covering the jacksonwatercrisis cbsnews 
2021-03-01 20:53:20+00:00,1.36649E+18,I can‚Äôt believe this is happening ...again.   #JacksonWaterCrisis #FlintWaterCrisis https://t.co/Fffg0fqp05,upfrontfanatic,Midwest ,0,2,2,0,3/1/2021,0,3,i can t believe this is happening again jacksonwatercrisis flintwatercrisis 
2021-03-01 19:47:19+00:00,1.36648E+18,".@edlavaCNN .@brikeilarcnn:
 There's water crisis in #Jackson, #Mississippi. Why's no cable or network news not highlighting it as you are doing with #TexasPowerOutage ? #JacksonWaterCrisis #CNN #MSNBC #FoxNews",kojman1,,0,0,0,1,3/1/2021,-0.743,3, edlavacnn brikeilarcnn there s water crisis in jackson mississippi why s no cable or network news not highlighting it as you are doing with texaspoweroutage jacksonwatercrisis cnn msnbc foxnews
2021-03-01 19:31:39+00:00,1.36647E+18,".@brikeilarcnn : There's water crisis in #Jackson, #Mississippi. Why's no cable or network news not highlighting it as you are doing with #TexasPowerOutage ? #JacksonWaterCrisis #CNN #MSNBC #FoxNews https://t.co/YDYEvwL6aD",kojman1,,0,0,0,0,3/1/2021,-0.743,3, brikeilarcnn there s water crisis in jackson mississippi why s no cable or network news not highlighting it as you are doing with texaspoweroutage jacksonwatercrisis cnn msnbc foxnews 
2021-03-01 11:01:35+00:00,1.36634E+18,"OMG, this is new to me. #JacksonWaterCrisis #RetweeetPlease #Texas. .@CNN .@MSNBC #CNN .@WayTooEarly #waytooearly .@kasie .@JoeNBC .@JoeBiden #Biden .@KamalaHarris #networks .@fema .@NewDay #MSNBC.@NBCNews .@ABC .@CBSNews #CBS #NBC #ABC  .@AP .@FoxNews #FoxNews #CBSNews #ABCNews https://t.co/gdJMVZROVz",kojman1,,0,0,0,1,3/1/2021,0,3,omg this is new to me jacksonwatercrisis retweeetplease texas cnn msnbc cnn waytooearly waytooearly kasie joenbc joebiden biden kamalaharris networks fema newday msnbc nbcnews abc cbsnews cbs nbc abc ap foxnews foxnews cbsnews abcnews 
2021-03-01 06:24:26+00:00,1.36627E+18,#JacksonMS #Mississippi #JacksonWaterCrisis #NoRunningWater #WaterCrisis https://t.co/WWauCO80Tr,Fitness4Duty,,0,0,0,0,3/1/2021,0,3, jacksonms mississippi jacksonwatercrisis norunningwater watercrisis 
2021-03-01 05:51:18+00:00,1.36626E+18,"@JollyMollyRoger @srfn_fitness @petersabuchan1 @MarkRuffalo @DebHaalandNM If we chant his name three times around a water filter, might he appear?
@MarkRuffalo !  @MarkRuffalo !  @MarkRuffalo !  #JacksonWaterCrisis !",sffcorgi,Looking over your shoulder,0,0,1,0,3/1/2021,0,3, jollymollyroger srfn fitness  markruffalo debhaalandnm if we chant his name three times around a water filter might he appear markruffalo markruffalo markruffalo jacksonwatercrisis 
2021-03-01 05:28:56+00:00,1.36626E+18,"@JollyMollyRoger @srfn_fitness @petersabuchan1 I've seen it mentioned, but I don't have any idea of WHY there is a #JacksonWaterCrisis.",sffcorgi,Looking over your shoulder,2,0,2,0,3/1/2021,0,3, jollymollyroger srfn fitness  i ve seen it mentioned but i don t have any idea of why there is a jacksonwatercrisis 
2021-03-01 01:40:19+00:00,1.3662E+18,"#JacksonWaterCrisis  
... as I was saying ... https://t.co/JH18bhnPmB",NotGr8flJstDead,,0,0,0,0,3/1/2021,0,3, jacksonwatercrisis as i was saying 
2021-02-28 23:19:12+00:00,1.36617E+18,@cindyhydesmith @RogerWicker @RepMichaelGuest The City of Jackson water problems resemble that of a third-world country. The federal government has to step in. Please cooperate with Democrats to address this issue. #JacksonWaterCrisis,MarkHutch1965,"Jackson, MS",0,0,0,0,2/28/2021,-0.1027,2, cindyhydesmith rogerwicker repmichaelguest the city of jackson water problems resemble that of a third world country the federal government has to step in please cooperate with democrats to address this issue jacksonwatercrisis
2021-02-28 22:35:32+00:00,1.36616E+18,"Jackson, Mississippi residents have been without running water for almost 2 weeks now. Why and how is this not being talked about? If you see this tweet, please don‚Äôt scroll by. The people in Jackson deserve better. #JacksonWaterCrisis #JacksonMS #WaterForJackson",TragicalExpress,"Florida, USA",1,0,1,0,2/28/2021,0.6369,2,jackson mississippi residents have been without running water for almost  weeks now why and how is this not being talked about if you see this tweet please don t scroll by the people in jackson deserve better jacksonwatercrisis jacksonms waterforjackson
2021-02-28 18:23:04+00:00,1.36609E+18,"11 days. No safe, running, flushable water. Jackson, MS. That's it. That's the tweet. #JacksonWaterCrisis #JacksonMSWaterCrisis https://t.co/lBJmmK7vTz",HeadedToTherapy,,0,2,0,0,2/28/2021,-0.3412,2, days no safe running flushable water jackson ms that s it that s the tweet jacksonwatercrisis jacksonmswatercrisis 
2021-02-28 17:51:22+00:00,1.36608E+18,#JacksonMSWaterCrisis #JacksonWaterCrisis https://t.co/HLWAiqX1XG,HeadedToTherapy,,0,1,0,0,2/28/2021,0,2, jacksonmswatercrisis jacksonwatercrisis 
2021-02-28 13:52:10+00:00,1.36602E+18,"#jacksonwatercrisis 
@CNN @TODAYshow @washingtonpost @nowthisnews https://t.co/ht40ooqo5L",dropahontas,,2,0,0,0,2/28/2021,0,2, jacksonwatercrisis cnn todayshow washingtonpost nowthisnews 
2021-02-28 09:03:46+00:00,1.36595E+18,"#JacksonWaterCrisis
@jaketapper @andersoncooper 
@maddow 
@donlemon 
@Lawrence https://t.co/6ABWPW0Zid",00Lilac_Sky00,New York,0,0,0,0,2/28/2021,0,2, jacksonwatercrisis jaketapper andersoncooper maddow donlemon lawrence 
2021-02-28 02:55:47+00:00,1.36586E+18,"Thank you @angiecthomas for sharing this info. We heard about Texas, but not Jackson. Over 10 days without running water. #Jackson #JacksonWaterCrisis  https://t.co/VyQQnOoxPV https://t.co/lYST8xtdIW",starchaser14,"North Hollywood, Los Angeles",0,0,0,0,2/28/2021,0.3919,2,thank you angiecthomas for sharing this info we heard about texas but not jackson over  days without running water jackson jacksonwatercrisis 
2021-02-27 22:47:21+00:00,1.3658E+18,@SenHydeSmith @DeptofDefense @USNavy @SenatorWicker @marcorubio @MarshaBlackburn @SenRickScott @SecDef https://t.co/u3quzBFpBP #JacksonWaterCrisis,EricVolat,United States,0,0,1,0,2/27/2021,0,2, senhydesmith deptofdefense usnavy senatorwicker marcorubio marshablackburn senrickscott secdef jacksonwatercrisis
2021-02-27 22:45:34+00:00,1.3658E+18,@SenatorWicker https://t.co/u3quzBFpBP #JacksonWaterCrisis,EricVolat,United States,0,0,0,0,2/27/2021,0,2, senatorwicker jacksonwatercrisis
2021-02-19 19:24:58+00:00,1.36285E+18,#jacksonwatercrisis . we need the same attention y‚Äôall gave flint mi. üòÇüòÇüòÇüòÇ,xomls_,xoxo_otramitad,0,0,0,0,2/19/2021,0.891,2, jacksonwatercrisis we need the same attention y all gave flint mi 
2021-02-19 19:21:57+00:00,1.36284E+18,#jacksonwatercrisis,xomls_,xoxo_otramitad,0,0,0,0,2/19/2021,0,2, jacksonwatercrisis
2021-04-30 02:33:48+00:00,1.38796E+18,@RepLawrence @SafeH2o4Schools @POTUS I would like @POTUS to come back to Mississippi so that he can witness the same disparities that he saw on the campaign trail in 2004. The #JxnNeedsWater crisis is just as egregious as the #HookwormEpidemic in Alabama.,chefcarney,"Biloxi, MS ",1,0,0,0,4/30/2021,-0.3818,4, replawrence  potus i would like potus to come back to mississippi so that he can witness the same disparities that he saw on the campaign trail in  the jxnneedswater crisis is just as egregious as the hookwormepidemic in alabama donnerkay 
2021-04-29 15:09:37+00:00,1.38779E+18,"Welcome newcomers! 

Also: #FreeBritney #FreeAssange #FreePalestine #BDS #AbolishICE #JusticeForBreonnaTaylor #FlintWaterCrisis #JxnNeedsWater #BlackLivesMatter¬† #DefundThePolice #BlackTransLivesMatter¬† #YemenCantWait #Syria #M4A #CancelStudentDebt",tsalibian,"Los Angeles, CA",0,0,6,0,4/29/2021,0.5093,4,welcome newcomers also freebritney freeassange freepalestine bds abolishice justiceforbreonnataylor flintwatercrisis jxnneedswater blacklivesmatter defundthepolice blacktranslivesmatter yemencantwait syria  cancelstudentdebt
2021-04-23 13:43:11+00:00,1.38559E+18,"Good morning! Thank you for following my profile. 
Also: #FreeBritney #FreeAssange #FreePalestine #BDS #AbolishICE #JusticeForBreonnaTaylor #FlintWaterCrisis #JxnNeedsWater #BlackLivesMatter #AbolishThePolice #BlackTransLivesMatter #YemenCantWait #Syria #M4A #CancelStudentDebt",tsalibian,"Los Angeles, CA",0,1,2,0,4/23/2021,0.69,4,good morning thank you for following my profile also freebritney freeassange freepalestine bds abolishice justiceforbreonnataylor flintwatercrisis jxnneedswater blacklivesmatter abolishthepolice blacktranslivesmatter yemencantwait syria  cancelstudentdebt
2021-04-17 22:21:39+00:00,1.38355E+18,"‚ÄúThe overflow of Jackson‚Äôs west bank interceptor generally can occur when water flow exceeds the pumping capacity of the Savanna Wastewater Treatment Plant, according to a quarterly report by the City of Jackson.‚Äù This contributed to the reason why #JxnNeedsWater was a hashtag",chefcarney,"Biloxi, MS ",1,0,0,0,4/17/2021,0,4, the overflow of jackson s west bank interceptor generally can occur when water flow exceeds the pumping capacity of the savanna wastewater treatment plant according to a quarterly report by the city of jackson this contributed to the reason why jxnneedswater was a hashtag
2021-04-09 18:19:36+00:00,1.38059E+18,#WeDeclare #JxnNeedsWater #SouthernPeoplePower https://t.co/zRTau50nfM,CalanKD,"Jackson, MS",0,3,3,0,4/9/2021,0,4, wedeclare jxnneedswater southernpeoplepower 
2021-04-06 22:33:37+00:00,1.37956E+18,"Welcome to those newly following! 
Also: #FreeBritney #FreeAssange #FreePalestine #BDS #AbolishICE #JusticeForBreonnaTaylor #FlintWaterCrisis #JxnNeedsWater #BlackLivesMatter #DefundThePolice #BlackTransLivesMatter #YemenCantWait #Syria #M4A #CancelStudentDebt",tsalibian,"Los Angeles, CA",0,1,2,0,4/6/2021,0.5093,4,welcome to those newly following also freebritney freeassange freepalestine bds abolishice justiceforbreonnataylor flintwatercrisis jxnneedswater blacklivesmatter defundthepolice blacktranslivesmatter yemencantwait syria  cancelstudentdebt
2021-04-03 20:39:55+00:00,1.37845E+18,We have an obligation to speak truth to power when given the opportunity. #ADOS‚úäüèæactivists have influenced community leaders to advocate on behalf of our #ADOS‚úäüèæcommunities. #BootsOnTheGround! @MississippiAdos @PeterHotez #NTDs #JxnNeedsWater. https://t.co/RJpf7fjPCF https://t.co/OKDT6ozXjC,chefcarney,"Biloxi, MS ",0,0,0,0,4/3/2021,0.6588,4,we have an obligation to speak truth to power when given the opportunity ados activists have influenced community leaders to advocate on behalf of our ados communities bootsontheground mississippiados peterhotez ntds jxnneedswater 
2021-03-28 07:36:49+00:00,1.37608E+18,@ItIsWhatItIsGuy @KillerMike @MississippiAdos @KillerMike are you up to the challenge of standing up against both sides of the aisle? #ADOS‚úäüèæ are still standing on the square of specific policies for or political interests? #JxnNeedsWater in Mississi,chefcarney,"Biloxi, MS ",0,0,1,0,3/28/2021,0.3939,3, itiswhatitisguy killermike mississippiados killermike are you up to the challenge of standing up against both sides of the aisle ados are still standing on the square of specific policies for or political interests jxnneedswater in mississippi til this day come to mississippi and see for yourself 
2021-03-21 13:15:09+00:00,1.37362E+18,"Jackson, Mississippi STILL does not have water. #MutualAid funds &amp; how to support via @scalawagmag:  https://t.co/yV6sPugeiC üñ§üíß

#JxnNeedsWater https://t.co/XYqlXAB4nA",NewEconomics,"Boston, MA",0,12,9,0,3/21/2021,0.7845,3,jackson mississippi still does not have water mutualaid funds amp how to support via scalawagmag jxnneedswater 
2021-03-17 23:05:32+00:00,1.37232E+18,"Mom joked when we wld watch  @ErinBrockovich speak or the movie that the I reminded her of that kind of person. 
The kind who would distract someone with her titties for the ppl was what she meantüòé.
I didn't think I wld end up fighting for water access thoüòí
#JxnNeedsWater still",smartstatistic,"Jackson, MS",1,5,33,0,3/17/2021,0.6124,3,mom joked when we wld watch erinbrockovich speak or the movie that the i reminded her of that kind of person the kind who would distract someone with her titties for the ppl was what she meant i didn t think i wld end up fighting for water access tho jxnneedswater still
2021-03-17 19:35:14+00:00,1.37227E+18,HALLELUJAH! I‚Äôm still waiting for a call to my house telling me it is lifted before flushing the lines but this is exciting news! #JxnNeedsWater https://t.co/4oB7tcwCVo,FBrownWilliams,"Jackson, MS",1,3,11,0,3/17/2021,0.8294,3,hallelujah i m still waiting for a call to my house telling me it is lifted before flushing the lines but this is exciting news jxnneedswater 
2021-03-17 13:19:20+00:00,1.37218E+18,"Thank you @emilygordine for capturing and telling the story of the struggle of our Brother‚Äôs and Sister‚Äôs in Mississippi that has gone on far too long. 

#NoAccess
#JxnNeedsWater #MississippiNeedsWater https://t.co/3bhTaOdiVp",MarquiseHunt,United States,0,3,13,0,3/17/2021,0.0516,3,thank you emilygordine for capturing and telling the story of the struggle of our brother s and sister s in mississippi that has gone on far too long noaccess jxnneedswater mississippineedswater 
2021-03-17 13:10:59+00:00,1.37217E+18,"It‚Äòs been a month since a winter storm hit southern parts of the US. Mississippi was quickly forgotten yet thousands of residents have had #noaccess to #drinkingwater ever since. My report from Jackson, MS. #JxnNeedsWater https://t.co/qqMUT1ut6t",emilygordine,,0,19,21,1,3/17/2021,-0.2263,3,it s been a month since a winter storm hit southern parts of the us mississippi was quickly forgotten yet thousands of residents have had noaccess to drinkingwater ever since my report from jackson ms jxnneedswater 
2021-03-16 18:14:16+00:00,1.37189E+18,"This exacerbates an already dire #HumanitarianCrisis in Jackson Mississippi and surrounding communities.#JxnNeedsWater 
@MississippiAdos #ADOSHQ https://t.co/IkiiU4AwHQ",chefcarney,"Biloxi, MS ",0,0,0,0,3/16/2021,-0.4588,3,this exacerbates an already dire humanitariancrisis in jackson mississippi and surrounding communities jxnneedswater mississippiados adoshq 
2021-03-16 15:39:49+00:00,1.37185E+18,"As a reminder, the majority of Jackson, Mississippi remains under a boil water notice, meaning our water is not safe to drink. 
#JxnNeedsWater https://t.co/EcHsrSTcVp",FBrownWilliams,"Jackson, MS",5,52,78,2,3/16/2021,-0.3412,3,as a reminder the majority of jackson mississippi remains under a boil water notice meaning our water is not safe to drink jxnneedswater 
2021-03-16 11:32:09+00:00,1.37179E+18,"@RepRichmond @SymoneDSanders could you please tell President @JoeBiden that #JxnNeedsWater? Democratic voters in Mississippi deserve representation from this Administration. Blacks make up 38-40% of the population in MS.
@MississippiAdos #ADOSHQ 

https:/",chefcarney,"Biloxi, MS ",0,4,2,0,3/16/2021,0.3182,3, reprichmond symonedsanders could you please tell president joebiden that jxnneedswater democratic voters in mississippi deserve representation from this administration blacks make up   of the population in ms mississippiados adoshq 
2021-03-13 23:10:44+00:00,1.37088E+18,"FYI, #JxnNeedsWater STILL.  When is Tater Tot gonna handle this? https://t.co/uoh33c2jcZ",PickyVeg,"Mobile, AL",0,0,0,0,3/13/2021,0.368,3,fyi jxnneedswater still when is tater tot gonna handle this 
2021-03-13 22:11:25+00:00,1.37086E+18,"Despite reports of #Jackson having water again we don't have water we can drink coming out of our facets and many still have no water at all including my house. 
 
@FundMSabortions was out dispensing water and bags of food today. 
#JxnNeedsWater
#MSWaterCrisis https://t.co/xDb3KDNlbe",smartstatistic,"Jackson, MS",0,63,78,5,3/13/2021,-0.296,3,despite reports of jackson having water again we don t have water we can drink coming out of our facets and many still have no water at all including my house fundmsabortions was out dispensing water and bags of food today jxnneedswater mswatercrisis 
2021-03-13 20:17:23+00:00,1.37083E+18,Welcome to all the new folk following my profile! Also: #FreeBritney #FreeAssange #FreePalestine #BDS #AbolishICE #JusticeForBreonnaTaylor #FlintWaterCrisis #JxnNeedsWater #BlackLivesMatter #DefundThePolice #BlackTransLivesMatter #YemenCantWait #Syria #M4A #CancelStudentDebt ...,tsalibian,"Los Angeles, CA",0,0,0,0,3/13/2021,0.5093,3,welcome to all the new folk following my profile also freebritney freeassange freepalestine bds abolishice justiceforbreonnataylor flintwatercrisis jxnneedswater blacklivesmatter defundthepolice blacktranslivesmatter yemencantwait syria  cancelstudentdebt 
2021-03-13 18:12:33+00:00,1.3708E+18,#JxnNeedsWater https://t.co/h9jB2uNe2Z,NotGr8flJstDead,,0,0,0,0,3/13/2021,0,3, jxnneedswater 
2021-03-12 22:38:32+00:00,1.3705E+18,Petty Waters Run Deep - Token Talk Podcast discusses the #JxnNeedsWater crisis via Zoom üíª https://t.co/ihw4ZIkKBx via @YouTube,TokenTalkTweets,"Mississippi, USA",0,0,2,0,3/12/2021,-0.7096,3,petty waters run deep token talk podcast discusses the jxnneedswater crisis via zoom via youtube
2021-03-12 21:51:26+00:00,1.37049E+18,"No kids, but even as an adult little things take much more time an effort ‚Äî like brushing your teeth when you can‚Äôt use the water from your sink. Cannot imagine parenting a young child in this. 
#JxnNeedsWater https://t.co/0m72jTKs9J",FBrownWilliams,"Jackson, MS",2,1,6,1,3/12/2021,0.3919,3,no kids but even as an adult little things take much more time an effort like brushing your teeth when you can t use the water from your sink cannot imagine parenting a young child in this jxnneedswater 
2021-03-12 00:20:53+00:00,1.37017E+18,"@KimberlyLCampb3 Thank you all for you contributions! 
#JxnNeedsWater @MississippiAdos",chefcarney,"Biloxi, MS ",0,0,1,0,3/12/2021,0.4199,3,  thank you all for you contributions jxnneedswater mississippiados
2021-03-11 15:21:39+00:00,1.37003E+18,The Governor is about to hold a signing ceremony with legislators for a bill that is a baseless attack on women and girl student-athletes who are transgender. Meanwhile #JxnNeedsWater #LetKidsPlay,FBrownWilliams,"Jackson, MS",6,26,60,4,3/11/2021,-0.4767,3,the governor is about to hold a signing ceremony with legislators for a bill that is a baseless attack on women and girl student athletes who are transgender meanwhile jxnneedswater letkidsplay
2021-03-10 23:52:50+00:00,1.3698E+18,"THIS, THIS, THIS #JxnNeedsWater https://t.co/NsXmzKj8u6",FBrownWilliams,"Jackson, MS",1,4,5,0,3/10/2021,0,3,this this this jxnneedswater 
2021-03-10 23:26:42+00:00,1.36979E+18,Very glad to see some of our South Jackson folks have their boil water notice lifted and we'll be waiting because ALLLLLL of #JxnNeedsWater,FBrownWilliams,"Jackson, MS",0,1,8,0,3/10/2021,0.5095,3,very glad to see some of our south jackson folks have their boil water notice lifted and we ll be waiting because allllll of jxnneedswater
2021-03-10 17:30:27+00:00,1.3697E+18,Jackson doesn't have safe water. #JxnNeedsWater https://t.co/lpoqlWrG0W,FBrownWilliams,"Jackson, MS",0,7,7,0,3/10/2021,-0.3412,3,jackson doesn t have safe water jxnneedswater 
2021-03-10 17:29:45+00:00,1.3697E+18,Jackson doesn't have safe water. We remain under a boil water notice. Read more here.  #JxnNeedsWater https://t.co/kaT27fxCj8,FBrownWilliams,"Jackson, MS",0,0,1,0,3/10/2021,-0.3412,3,jackson doesn t have safe water we remain under a boil water notice read more here jxnneedswater 
2021-03-09 20:19:25+00:00,1.36938E+18,"How is Jackson, Mississippi, doing today?
Where are we at with correcting things there?
#JxnNeedsWater
Is Tater Governor #Reeves out there doing what he is paid to do?
Or somewhere doing what he's paid to do?-
Remedying things?!",probheardright,,0,0,0,0,3/9/2021,0,3,how is jackson mississippi doing today where are we at with correcting things there jxnneedswater is tater governor reeves out there doing what he is paid to do or somewhere doing what he s paid to do remedying things 
2021-03-09 01:46:38+00:00,1.3691E+18,#JxnNeedsWater please donate/share! https://t.co/IAXET7xshS,actiphysicist,Duwamish territory / Seattle,0,0,2,0,3/9/2021,0.3802,3, jxnneedswater please donate share 
2021-03-08 22:25:44+00:00,1.36905E+18,"This week on the @VisuNewsUSA podcast I chat with @smartstatistic about the water crisis in #Jackson Mississippi and much more. 

While it's fallen out of a lot of the news there's a longer-term crisis in many cities in the South right now.

#JxnNeedsWater
https://t.co/Rz4bjQnkfg",zdroberts,"New York, USA",0,5,4,0,3/8/2021,-0.8993,3,this week on the visunewsusa podcast i chat with smartstatistic about the water crisis in jackson mississippi and much more while it s fallen out of a lot of the news there s a longer term crisis in many cities in the south right now jxnneedswater 
2021-03-08 21:16:49+00:00,1.36903E+18,#JxnNeedsWater  Water distribution TODAY in Jackson: https://t.co/Sdc5oWlxG5,NotGr8flJstDead,,0,0,0,0,3/8/2021,0,3, jxnneedswater water distribution today in jackson 
2021-03-08 07:27:43+00:00,1.36883E+18,"If y'all don't know about this crap,
#JxnNeedsWater ‚¨ÖÔ∏è https://t.co/fbt7sx5PNr",jenelaina,Michigan/Huron Potawatomi land,0,2,2,0,3/8/2021,-0.4588,3,if y all don t know about this crap jxnneedswater 
2021-03-08 00:22:20+00:00,1.36872E+18,"Shared what I did in Jackson yesterday delivering water &amp; supplies for #MississippiRelief #JxnNeedsWater on IG. Greater Allen Temple AME Church sent me these pics and on the left I‚Äôm pictured with Rev Mullins, Presiding Elder Goodloe &amp; the 8th district Bishop Julius McAllister Sr https://t.co/0lgD4FJab6",_dawnmontgomery,"Atlanta, GA",2,8,26,1,3/8/2021,0.5994,3,shared what i did in jackson yesterday delivering water amp supplies for mississippirelief jxnneedswater on ig greater allen temple ame church sent me these pics and on the left i m pictured with rev mullins presiding elder goodloe amp the  district bishop julius mcallister sr 
2021-03-07 22:47:39+00:00,1.36869E+18,"‚Äú[This] is not just happening in Jackson,‚Äù said Holmes, who called the widespread infrastructure problems a failure of state government. ‚ÄúThis is an issue with crumbling infrastructure across the state of Mississippi, not just in Jackson.‚Äù https://t.co/rN2zc2Gi6P #JxnNeedsWater",TheWayWithAnoa,"Atlanta, GA",1,19,35,2,3/7/2021,-0.7184,3, is not just happening in jackson said holmes who called the widespread infrastructure problems a failure of state government this is an issue with crumbling infrastructure across the state of mississippi not just in jackson jxnneedswater
2021-03-07 14:11:10+00:00,1.36856E+18,Please amplify! Our Venmo is @ mdeep or you can donate at this link https://t.co/EQEPJBPYVl We will match your donation! #JxnNeedsWater https://t.co/Eob7za3LtI,educates_ms,,0,6,3,1,3/7/2021,0.4374,3,please amplify our venmo is mdeep or you can donate at this link we will match your donation jxnneedswater 
2021-03-07 14:10:19+00:00,1.36856E+18,"For those in the back, üó£ Jackson still needs MF water! #JxnNeedsWater 
https://t.co/jEC4iXJ9XZ https://t.co/436bgqbpQ4",bfeldman89,"Mississippi, USA",0,5,5,0,3/7/2021,0,3,for those in the back jackson still needs mf water jxnneedswater 
2021-03-07 00:25:37+00:00,1.36836E+18,Finally eating dinner with my Mom @RosaSBarron1 &amp; Dad @BarronPlanning at @CHARofjackson after donating water &amp; supplies for #MississippiRelief #JxnNeedsWater,_dawnmontgomery,"Atlanta, GA",2,0,4,0,3/7/2021,0,3,finally eating dinner with my mom  amp dad barronplanning at charofjackson after donating water amp supplies for mississippirelief jxnneedswater
2021-03-06 18:22:16+00:00,1.36827E+18,"Jackson, MS doesn't have safe water. This is why. #JxnNeedsWater https://t.co/X9wMxUiP9f",FBrownWilliams,"Jackson, MS",0,46,96,0,3/6/2021,-0.3412,3,jackson ms doesn t have safe water this is why jxnneedswater 
2021-03-06 17:08:19+00:00,1.36825E+18,@ChokweALumumba How's the water at the Capitol Building and Governors Mansion?  Perhaps those water mains need shut down to ease pressure on the neighborhoods around them?? Just wondering..........??  #JxnNeedsWater,gibu02,,0,0,1,0,3/6/2021,0.3094,3, chokwealumumba how s the water at the capitol building and governors mansion perhaps those water mains need shut down to ease pressure on the neighborhoods around them just wondering jxnneedswater
2021-03-06 17:00:45+00:00,1.36825E+18,"@CNNSotu @tatereeves @jaketapper Having our state capitol in the national news makes me so proud to live in MS. Once all the current Jackson residents move out, what companies will be building / rebuilding the new housing developments so I can start inves",gibu02,,1,0,2,0,3/6/2021,0.6113,3, cnnsotu tatereeves jaketapper having our state capitol in the national news makes me so proud to live in ms once all the current jackson residents move out what companies will be building rebuilding the new housing developments so i can start investing now jxnneedswater
2021-03-06 16:43:10+00:00,1.36824E+18,#JxnNeedsWater please help! https://t.co/pKWBK8RTel,greedyapricot,United States of Apartheid,0,5,4,0,3/6/2021,0.6476,3, jxnneedswater please help 
2021-03-06 16:01:00+00:00,1.36823E+18,"#JxnNeedsWater white flight has a lot to do with this problem.  Now that the whites have relocated, they don't want to fix problems which they're responsible for.  They let the city infrastructure run down without fixing, then left the problem for the next administrations. https://t.co/WBaXKjrh3w",NotGr8flJstDead,,1,6,10,0,3/6/2021,-0.7541,3, jxnneedswater white flight has a lot to do with this problem now that the whites have relocated they don t want to fix problems which they re responsible for they let the city infrastructure run down without fixing then left the problem for the next administrations 
2021-03-06 15:30:49+00:00,1.36822E+18,"So did I really just read that? Lt. Governor .@DelbertHosemann called .@JacksonAirports ""my airport"" and offered .@CityOfJxnMS mayor .@ChokweALumumba $30 million for it? What the what??

#Mississippi #JacksonMississippi #JacksonMS #Jackson #JXN #JXNneedsWater #MSgov #MSleg #MSpol https://t.co/k3XfvtTP0B",itsthejody,·∂†·µí·µò ≥·µó ∞  ≥·µí·∂ú·µè ·∂† ≥·µí·µê ·µó ∞·µâ À¢·µò‚Åø,0,0,2,0,3/6/2021,0,3,so did i really just read that lt governor delberthosemann called jacksonairports my airport and offered cityofjxnms mayor chokwealumumba  million for it what the what mississippi jacksonmississippi jacksonms jackson jxn jxnneedswater msgov msleg mspol 
2021-03-06 14:44:15+00:00,1.36821E+18,"I bet if .@CityOfJxnMS shut off water to the Governor's Mansion &amp; the state capitol building, the legislature, .@tatereeves &amp; .@DelbertHosemann would get Jackson's water system fixed. Fast.

#Mississippi #JacksonMississippi #JacksonMS #Jackson #JXN #JXNneedsWater #MSgov #MSleg",itsthejody,·∂†·µí·µò ≥·µó ∞  ≥·µí·∂ú·µè ·∂† ≥·µí·µê ·µó ∞·µâ À¢·µò‚Åø,2,2,9,0,3/6/2021,0,3,i bet if cityofjxnms shut off water to the governor s mansion amp the state capitol building the legislature tatereeves amp delberthosemann would get jackson s water system fixed fast mississippi jacksonmississippi jacksonms jackson jxn jxnneedswater msgov msleg
2021-03-06 14:17:35+00:00,1.3682E+18,"Jackson, MS doesn't have safe water. #JxnNeedsWater https://t.co/Kmh4O0v55K",FBrownWilliams,"Jackson, MS",2,10,37,1,3/6/2021,-0.3412,3,jackson ms doesn t have safe water jxnneedswater 
2021-03-06 14:14:21+00:00,1.3682E+18,"From yesterday. This is good news. 
Jackson, MS doesn't have safe water. #JxnNeedsWater https://t.co/lgwpIzKQvt",FBrownWilliams,"Jackson, MS",0,4,13,0,3/6/2021,0.1265,3,from yesterday this is good news jackson ms doesn t have safe water jxnneedswater 
2021-03-06 04:02:37+00:00,1.36805E+18,#JxnNeedsWater this is good news : https://t.co/t4c7j88RBG,NotGr8flJstDead,,0,1,2,0,3/6/2021,0.4404,3, jxnneedswater this is good news 
2021-03-06 02:23:23+00:00,1.36802E+18,"Found a new hashtag 
#JxnNeedsWater 

#MSWater
#Mississippi https://t.co/SZkZnTQVt5",Tinu,"Texas, somehow.",1,34,50,3,3/6/2021,0,3,found a new hashtag jxnneedswater mswater mississippi 
2021-03-06 02:18:31+00:00,1.36802E+18,"Jackson team getting water out to the community.
Including dropping off at the Boys and Girls Club. 
Tuscaloosa team reloading. 
#JxnNeedsWater 
Donate to @FundMSabortions
https://t.co/z46utQ6TmM 
Or the group effort below https://t.co/NM2wG7AdY9",smartstatistic,"Jackson, MS",1,43,64,1,3/6/2021,0,3,jackson team getting water out to the community including dropping off at the boys and girls club tuscaloosa team reloading jxnneedswater donate to fundmsabortions or the group effort below 
2021-03-05 22:22:23+00:00,1.36796E+18,This. #JxnNeedsWater https://t.co/yfb03VbTo9,FBrownWilliams,"Jackson, MS",0,0,5,0,3/5/2021,0,3,this jxnneedswater 
2021-03-05 21:43:00+00:00,1.36795E+18,"It‚Äôs been 3 weeks‚Ä¶üòë

üó£#JxnNeedsWater",jsudiva,,0,0,0,0,3/5/2021,0,3,it s been  weeks jxnneedswater
2021-03-05 21:11:54+00:00,1.36795E+18,"""It's certainly difficult to say it's not an #EnvironmentalJustice issue, even though we've never framed it that way. It's an old legacy city, it's a majority Black city, &amp; like urban areas across the country, it's been redlined &amp; divested."" #JxnNeedsWater
https://t.co/wrxuoILnnS",cleanh2oaction,United States,0,5,1,0,3/5/2021,0.34,3, it s certainly difficult to say it s not an environmentaljustice issue even though we ve never framed it that way it s an old legacy city it s a majority black city amp like urban areas across the country it s been redlined amp divested jxnneedswater 
2021-03-05 18:48:01+00:00,1.36791E+18,#JxnNeedsWater @MississippiAdos @tatereeves https://t.co/hmMH056tM9,chefcarney,"Biloxi, MS ",0,1,2,0,3/5/2021,0,3, jxnneedswater mississippiados tatereeves 
2021-03-05 11:40:13+00:00,1.3678E+18,@KayAnneSkinner I spoke with @LeahMWillingham about the correlation between the reasons why #JxnNeedsWater and the lifting of the #MaskMandate in Mississippi. Essential workers are impacted in both instances. @tatereeves has consistently neglected our mar,chefcarney,"Biloxi, MS ",0,0,1,0,3/5/2021,-0.5267,3, kayanneskinner i spoke with leahmwillingham about the correlation between the reasons why jxnneedswater and the lifting of the maskmandate in mississippi essential workers are impacted in both instances tatereeves has consistently neglected our marginalized communities mississippiados
2021-03-05 06:50:43+00:00,1.36773E+18,".@tlamar44 with foot and mouth disease. Again. ü§¶üèª‚Äç‚ôÇÔ∏è
#Mississippi #MSgov #MSpol #MSleg #MShouse #Jackson #JacksonMississippi #JXN #JxnNeedsWater #MSwx https://t.co/6sE4w1IFer",itsthejody,·∂†·µí·µò ≥·µó ∞  ≥·µí·∂ú·µè ·∂† ≥·µí·µê ·µó ∞·µâ À¢·µò‚Åø,0,0,1,0,3/5/2021,0,3,  with foot and mouth disease again mississippi msgov mspol msleg mshouse jackson jacksonmississippi jxn jxnneedswater mswx 
2021-03-05 01:43:19+00:00,1.36765E+18,Wherein Mississippi's Gov. Tate Reeves is clear he would rather stick it to the City of Jackson and the residents die -- because water is literally necessary for life -- than ensure we have access to safe water. #JxnNeedsWater https://t.co/V5mFNkH6HO,FBrownWilliams,"Jackson, MS",5,15,25,1,3/5/2021,0.4939,3,wherein mississippi s gov tate reeves is clear he would rather stick it to the city of jackson and the residents die because water is literally necessary for life than ensure we have access to safe water jxnneedswater 
2021-03-05 00:50:41+00:00,1.36764E+18,"Honestly we‚Äôve lost count of the days, but the message remains the same. 

üó£#JxnNeedsWater",jsudiva,,0,2,2,1,3/5/2021,0.09,3,honestly we ve lost count of the days but the message remains the same jxnneedswater
2021-03-05 00:09:36+00:00,1.36763E+18,"What are you doing to fix the Jackson and Byram water crises @tatereeves @ChokweALumumba @SenatorWicker @SenHydeSmith @BennieGThompson @JoeBiden?

#JacksonMississippi #Water #JxnNeedsWater https://t.co/NyUtzcsVWT",chrissistrunk,"Clinton, MS",0,1,1,0,3/5/2021,0,3,what are you doing to fix the jackson and byram water crises tatereeves chokwealumumba senatorwicker senhydesmith benniegthompson joebiden jacksonmississippi water jxnneedswater 
2021-03-04 23:42:23+00:00,1.36762E+18,"Some common sense by our former Governor.
üëèüèºüëèüèºüëèüèºüëèüèºüëèüèºüëèüèº

Also, .@CityOfJxnMS should make sure the water stays off at the Governor's Mansion &amp; the Capitol building.

Cc: .@ChokweALumumba

#Mississippi #MSgov #MSleg #MSpol #MSwx #Jackson #JacksonMississippi #JacksonMS #JxnNeedsWater https://t.co/p6enhyw8EI",itsthejody,·∂†·µí·µò ≥·µó ∞  ≥·µí·∂ú·µè ·∂† ≥·µí·µê ·µó ∞·µâ À¢·µò‚Åø,0,0,2,0,3/4/2021,0.3182,3,some common sense by our former governor also cityofjxnms should make sure the water stays off at the governor s mansion amp the capitol building cc chokwealumumba mississippi msgov msleg mspol mswx jackson jacksonmississippi jacksonms jxnneedswater 
2021-03-04 22:32:29+00:00,1.3676E+18,"Nearly 3 weeks after a historic winter storm swept through the state of MS, thousands of residents in and around Jackson are still without running water. If you are looking for ways to help, here is a list of some amazing grassroots orgs that are doing the work. #JxnNeedsWater https://t.co/7Q2BQFgduj",SPLCUnion,,2,4,3,0,3/4/2021,0.7579,3,nearly  weeks after a historic winter storm swept through the state of ms thousands of residents in and around jackson are still without running water if you are looking for ways to help here is a list of some amazing grassroots orgs that are doing the work jxnneedswater 
2021-03-04 16:20:42+00:00,1.36751E+18,"Keeping an eye on federal SB 209 that provides assistance to rural water, wastewater, and waste disposal systems affected by the COVID-19 pandemic, and for other purposes considering what we‚Äôve seen happen across with systems in the South in the past weeks. #JxnNeedsWater",CalanKD,"Jackson, MS",0,0,2,0,3/4/2021,-0.5267,3,keeping an eye on federal sb  that provides assistance to rural water wastewater and waste disposal systems affected by the covid  pandemic and for other purposes considering what we ve seen happen across with systems in the south in the past weeks jxnneedswater
2021-03-04 14:45:38+00:00,1.36749E+18,#JXNNEEDSWATER,djyoungvenom,"Jackson, MS",0,13,6,0,3/4/2021,0,3, jxnneedswater
2021-03-04 13:55:00+00:00,1.36747E+18,@inMOMniac @jeneps #JxnNeedsWater #WaterCrisisInDaSipp,smartstatistic,"Jackson, MS",0,0,0,0,3/4/2021,0,3, inmomniac jeneps jxnneedswater watercrisisindasipp
2021-03-04 13:46:36+00:00,1.36747E+18,I will be sharing water distribution info as much as I can today and updates about restoration of services. Last I heard yesterday is the city was working to clean the clogged filters causing the drop in pressure. The crisis continues #JxnNeedsWater https://t.co/qjugZiUedG,jxncat,"Jackson, MS",1,1,9,0,3/4/2021,-0.4404,3,i will be sharing water distribution info as much as i can today and updates about restoration of services last i heard yesterday is the city was working to clean the clogged filters causing the drop in pressure the crisis continues jxnneedswater 
2021-03-04 07:41:29+00:00,1.36738E+18,Right now #JxnNeedsWater when that ice storm hit people couldn't work.  It is first of the month folks. $15/hr in an omnibus relief bill is not the hill on which to die when people still need water to wash their asses. https://t.co/t6u0QB8aW4,amsmadwoman,The Happy Place,0,1,1,0,3/4/2021,-0.2023,3,right now jxnneedswater when that ice storm hit people couldn t work it is first of the month folks  hr in an omnibus relief bill is not the hill on which to die when people still need water to wash their asses 
2021-03-04 06:01:08+00:00,1.36735E+18,"Correction: there are 40,000 Jackson residents without running water. Shout out to @e_hensley for this timely data. #JxnNeedsWater Donate to https://t.co/ZsIfraI6ZI to help with this humanitarian crisis. 
@MississippiAdos @DeKeitherStamps @RepZSummers https://t.co/YewDZhYscU",chefcarney,"Biloxi, MS ",0,1,2,0,3/4/2021,-0.34,3,correction there are   jackson residents without running water shout out to e hensley for this timely data jxnneedswater donate to to help with this humanitarian crisis mississippiados dekeitherstamps repzsummers 
2021-03-04 03:23:53+00:00,1.36731E+18,"Can we get a #CHLovesJackson fundraiser event? Is there one in the works? Jackson, MS could use our help. No one should go without water and three weeks is a travesty. #JxnNeedsWater",AllTheFlyKids,"Charlotte, NC",0,0,0,0,3/4/2021,-0.5514,3,can we get a chlovesjackson fundraiser event is there one in the works jackson ms could use our help no one should go without water and three weeks is a travesty jxnneedswater
2021-03-04 03:00:15+00:00,1.36731E+18,Mississippi is making national news tonight. The Governor was on Fox News earlier discussing lifting covid restrictions. Mayor Lumumba was just on MSNBC talking about water...or the lack of it. #JxnNeedsWater,MeganWestWAPT,"Jackson, MS",5,13,46,5,3/4/2021,-0.3182,3,mississippi is making national news tonight the governor was on fox news earlier discussing lifting covid restrictions mayor lumumba was just on msnbc talking about water or the lack of it jxnneedswater
2021-03-04 02:27:21+00:00,1.3673E+18,"Jackson, Mississippi, a majority black city, has gone three weeks without water. This is why infrastructure dollars are important and far too often, these cities are passed over. We need national news coverage to cover #JxnNeedsWater https://t.co/gkjwv6DuTZ",owl_janelle,"Potsdam, NY",0,2,1,0,3/4/2021,0.2023,3,jackson mississippi a majority black city has gone three weeks without water this is why infrastructure dollars are important and far too often these cities are passed over we need national news coverage to cover jxnneedswater 
2021-03-03 23:15:58+00:00,1.36725E+18,we literally just want running water #JxnNeedsWater https://t.co/AFwiDdyn35,sam_sherm,,0,0,4,0,3/3/2021,0.0772,3,we literally just want running water jxnneedswater 
2021-03-03 22:28:58+00:00,1.36724E+18,"Toilets stopped flushing again, anyone else having major pressure issues?#JxnNeedsWater",_salamrida,"Jackson, MS",1,0,1,0,3/3/2021,-0.5256,3,toilets stopped flushing again anyone else having major pressure issues jxnneedswater
2021-03-03 22:09:14+00:00,1.36724E+18,"11,000 Jackson residents are still without water after 3 weeks. If you are interested in helping out please contact Rep @DeKeitherStamps or Commander Herman Horton of Hinds County Community College. #JxnNeedsWater https://t.co/vomMAI5ddt https://t.co/l6k20TBtVo",chefcarney,"Biloxi, MS ",0,3,6,0,3/3/2021,0.7351,3,  jackson residents are still without water after  weeks if you are interested in helping out please contact rep dekeitherstamps or commander herman horton of hinds county community college jxnneedswater 
2021-03-03 18:14:22+00:00,1.36718E+18,"Solidarity with Jackson. Help @FundMSabortions help folks in Jackson. Their donation link is in their bio.

#JxnNeedsWater https://t.co/8KOoLi6IPv",flintfnb,"Fix the water, you bastards",0,2,2,0,3/3/2021,0.765,3,solidarity with jackson help fundmsabortions help folks in jackson their donation link is in their bio jxnneedswater 
2021-03-03 17:41:15+00:00,1.36717E+18,"Residents of Jackson, Mississippi have been without water for two weeks. @FundMSabortions is on the ground distributing water, diapers, and supplies. Donation link in bio. #JxnNeedsWater https://t.co/sGkxbRZ2Px",dc_fnb,Occupied Piscataway lands,0,0,1,1,3/3/2021,0,3,residents of jackson mississippi have been without water for two weeks fundmsabortions is on the ground distributing water diapers and supplies donation link in bio jxnneedswater 
2021-03-03 17:39:36+00:00,1.36717E+18,"Wear a mask, get vaccinated, and don‚Äôt forget Jackson, MS doesn't have safe water. #JxnNeedsWater https://t.co/ccDuZ44GnG",FBrownWilliams,"Jackson, MS",0,1,11,0,3/3/2021,-0.5116,3,wear a mask get vaccinated and don t forget jackson ms doesn t have safe water jxnneedswater 
2021-03-03 14:28:28+00:00,1.36712E+18,"Jackson, MS doesn't have safe water. #JxnNeedsWater #WearAMask https://t.co/KbR5SaER9Y",FBrownWilliams,"Jackson, MS",0,4,19,1,3/3/2021,-0.3412,3,jackson ms doesn t have safe water jxnneedswater wearamask 
2021-03-03 14:00:37+00:00,1.36711E+18,Anyways #JxnNeedsWater,Podaboo,,0,1,1,0,3/3/2021,0,3,anyways jxnneedswater
2021-03-03 06:40:36+00:00,1.367E+18,"The current water crisis in Jackson Mississippi and Louisiana is a #HumanitarianCrisis at this point. Our unincorporated communities are the most adversely effected. Infrastructure has to be a priority.  
@eji_org  @CathFlowers #JxnNeedsWater 

https://t.co/cciUVa76s2",chefcarney,"Biloxi, MS ",1,8,12,0,3/3/2021,-0.7346,3,the current water crisis in jackson mississippi and louisiana is a humanitariancrisis at this point our unincorporated communities are the most adversely effected infrastructure has to be a priority eji org cathflowers jxnneedswater 
2021-03-03 05:23:28+00:00,1.36698E+18,My family in Biloxi Mississippi is still trying to recover from the devastation of Hurricane Katrina. Jacksonians have been left to fend for themselves under the @tatereeves administration. Where is the Progressive Left? Do we have to be a Blue State? @jimmy_dore  #JxnNeedsWater https://t.co/vxLyE1KteT,chefcarney,"Biloxi, MS ",1,4,7,0,3/3/2021,-0.4871,3,my family in biloxi mississippi is still trying to recover from the devastation of hurricane katrina jacksonians have been left to fend for themselves under the tatereeves administration where is the progressive left do we have to be a blue state jimmy dore jxnneedswater 
2021-03-03 04:55:14+00:00,1.36698E+18,#JxnNeedsWater #jxnwatercrisis How to help: https://t.co/oU2sBivBYD,NotGr8flJstDead,,0,0,1,0,3/3/2021,0.4019,3, jxnneedswater jxnwatercrisis how to help 
2021-03-03 04:54:50+00:00,1.36698E+18,#JxnNeedsWater @WSJ @nytimes @washingtonpost Mississippians don‚Äôt have water. No national coverage. Two weeks and counting due to the same freeze that hit Texas. https://t.co/PCy0FQ2ZeR,jblagolden,TN,0,0,0,0,3/3/2021,-0.25,3, jxnneedswater wsj nytimes washingtonpost mississippians don t have water no national coverage two weeks and counting due to the same freeze that hit texas 
2021-03-03 04:13:02+00:00,1.36696E+18,"Please see how you can help with the ongoing Mississippi water crisis!! üëáüèºüëáüèº

#JxnNeedsWater https://t.co/yAvh7NNaOW",yoyobeatty,PA,0,0,1,0,3/3/2021,-0.1739,3,please see how you can help with the ongoing mississippi water crisis jxnneedswater 
2021-03-03 03:41:20+00:00,1.36696E+18,"""Infrastructure has been a historic problem, and for years each administration kept kicking that can down the road. This is a longtime issue, but now we're paying a severe price for that neglect.""

#JxnNeedsWater

https://t.co/ClbZ2mtwNy",cleanh2oaction,United States,0,0,1,1,3/3/2021,-0.85,3, infrastructure has been a historic problem and for years each administration kept kicking that can down the road this is a longtime issue but now we re paying a severe price for that neglect jxnneedswater 
2021-03-03 03:06:30+00:00,1.36695E+18,Discussing the water crisis in Mississippi with local organizers and impacted people in Jackson. Shoutout to @Phil_Lewis_ for hosting. Support @lumumbasvision and other orgs on the ground. #JxnNeedsWater https://t.co/iHOoOOLYQs,j_weathers,"Detroit, MI | Brooklyn, NY ",0,0,0,0,3/3/2021,-0.34,3,discussing the water crisis in mississippi with local organizers and impacted people in jackson shoutout to phil lewis for hosting support lumumbasvision and other orgs on the ground jxnneedswater 
2021-03-03 02:41:03+00:00,1.36694E+18,"In a rare break from the Governor, the State Health Officer stands firm with the evidence-based recommendation that Mississippians continue to wear masks. He knows lives are at stake, especially Black lives.  #becausescience #JxnNeedsWater  #BlackLivesMatter https://t.co/PIRGII9Ezm",FBrownWilliams,"Jackson, MS",0,4,11,0,3/3/2021,0,3,in a rare break from the governor the state health officer stands firm with the evidence based recommendation that mississippians continue to wear masks he knows lives are at stake especially black lives becausescience jxnneedswater blacklivesmatter 
2021-03-03 02:24:37+00:00,1.36694E+18,"These idiotic moves by @tatereeves and @GovAbbott to ‚Äúre-open‚Äù are an effort to distract from their bungling of the winter storms, and for Reeves, the humanitarian crisis happening on his doorstep in Jackson. 
Reminder: Jackson, MS doesn't have safe water. #msleg #JxnNeedsWater https://t.co/HH5DmiM0f5",FBrownWilliams,"Jackson, MS",1,23,34,0,3/3/2021,-0.9063,3,these idiotic moves by tatereeves and govabbott to re open are an effort to distract from their bungling of the winter storms and for reeves the humanitarian crisis happening on his doorstep in jackson reminder jackson ms doesn t have safe water msleg jxnneedswater 
2021-03-02 23:45:05+00:00,1.3669E+18,@SenSchumer @TravelingUS Jackson MS needs water.  We can't depend on the state to help Jackson.  #JxnNeedsWater,amsmadwoman,The Happy Place,0,1,1,0,3/2/2021,0.4019,3, senschumer travelingus jackson ms needs water we can t depend on the state to help jackson jxnneedswater
2021-03-02 22:05:35+00:00,1.36687E+18,"Brutal reminder that we cannot ""mutual aid"" our way out of capitalism. #JxnNeedsWater https://t.co/QtgeiyOZVn",tarynfivek,queens,0,4,11,0,3/2/2021,-0.6249,3,brutal reminder that we cannot mutual aid our way out of capitalism jxnneedswater 
2021-03-02 21:16:27+00:00,1.36686E+18,"@noname Thread on ways to help!
#JxnNeedsWater #JxnWaterCrisis

https://t.co/aLpo8TYaOK",LionOnLine1312,stolen & unceded land,0,3,2,0,3/2/2021,0.4574,3, noname thread on ways to help jxnneedswater jxnwatercrisis 
2021-03-02 21:16:20+00:00,1.36686E+18,"@KieseLaymon Thread on ways to help!
#JxnNeedsWater #JxnWaterCrisis

https://t.co/aLpo8TYaOK",LionOnLine1312,stolen & unceded land,0,0,1,0,3/2/2021,0.4574,3, kieselaymon thread on ways to help jxnneedswater jxnwatercrisis 
2021-03-02 21:14:24+00:00,1.36686E+18,"#JxnNeedsWater #jxnwatercrisis 
#BlackLivesMatter https://t.co/0h2xFrvd0T",LionOnLine1312,stolen & unceded land,0,0,0,0,3/2/2021,0,3, jxnneedswater jxnwatercrisis blacklivesmatter 
2021-03-02 20:31:30+00:00,1.36685E+18,". @chefjoseandres @WCKitchen - can you help?  #JxnNeedsWater In Jackson, Miss., two weeks with no running water and no end in sight https://t.co/DrPXeOCSnC",krobien,"Washington, DC",0,1,3,0,3/2/2021,-0.3182,3, chefjoseandres wckitchen can you help jxnneedswater in jackson miss two weeks with no running water and no end in sight 
2021-03-02 18:56:51+00:00,1.36682E+18,OMG! This is so sad üôèüèæ for Jackson. #JxnNeedsWater https://t.co/9fczzigMWm,tejarius,you decide..,0,0,0,0,3/2/2021,-0.6466,3,omg this is so sad for jackson jxnneedswater 
2021-03-02 18:33:07+00:00,1.36682E+18,"Here are ways to help MS, which hasn‚Äôt had water in three weeks. #JxnNeedsWater https://t.co/Uoa7JOkvO0",AlexGatPlay,,0,0,0,0,3/2/2021,0.4019,3,here are ways to help ms which hasn t had water in three weeks jxnneedswater 
2021-03-02 18:25:23+00:00,1.36682E+18,"Point is.. Jackson, Mississippi is going through a CRISIS. 14, 15 days without running water is absurd. #JxnNeedsWater #jxnwatercrisis",AngelRMorris,,1,0,3,0,3/2/2021,-0.7034,3,point is jackson mississippi is going through a crisis   days without running water is absurd jxnneedswater jxnwatercrisis
2021-03-02 17:52:56+00:00,1.36681E+18,"#JxnNeedsWater #jxnwatercrisis While we're on the subject of environmental racism: Jackson is a case study in it.  Remember this:

https://t.co/kQxIOqXhNt",NotGr8flJstDead,,0,0,1,0,3/2/2021,-0.6249,3, jxnneedswater jxnwatercrisis while we re on the subject of environmental racism jackson is a case study in it remember this 
2021-03-02 17:52:39+00:00,1.36681E+18,"I need to find Jesus for I know between #JxnNeedsWater  and the legislating for a return to Jim Crow voting laws, I needs sum Jesus.",amsmadwoman,The Happy Place,0,0,4,0,3/2/2021,0,3,i need to find jesus for i know between jxnneedswater and the legislating for a return to jim crow voting laws i needs sum jesus 
2021-03-02 17:39:42+00:00,1.36681E+18,"@noname here‚Äôs arekia‚Äôs thread. people are also using the hashtag #JxnNeedsWater to share what‚Äôs happening in the city:

https://t.co/M6JiFCDGwp",adriawalkr,ms‚úàÔ∏èny,0,17,22,3,3/2/2021,0.296,3, noname here s arekia s thread people are also using the hashtag jxnneedswater to share what s happening in the city 
2021-03-02 17:39:15+00:00,1.36681E+18,"@AlexGatPlay here‚Äôs arekia‚Äôs thread. people are also using the hashtag #JxnNeedsWater to share what‚Äôs happening in the city.

https://t.co/M6JiFCDGwp",adriawalkr,ms‚úàÔ∏èny,2,3,7,0,3/2/2021,0.296,3, alexgatplay here s arekia s thread people are also using the hashtag jxnneedswater to share what s happening in the city 
2021-03-02 17:37:44+00:00,1.3668E+18,@meowburger here‚Äôs arekia‚Äôs thread. people are also using the hashtag #JxnNeedsWater to share what‚Äôs happening in the city. https://t.co/5goKbHCASI,adriawalkr,ms‚úàÔ∏èny,1,3,3,0,3/2/2021,0.296,3, meowburger here s arekia s thread people are also using the hashtag jxnneedswater to share what s happening in the city 
2021-03-02 17:32:08+00:00,1.3668E+18,"@noname Memphis, TN here. We were without water for a week during an ice storm a week ago. A majority black city. Many without electricity. The city provided no help, everyone was too focused on Texas to care. #JxnNeedsWater",BuildingOurPwr,"Memphis, TN",1,2,12,0,3/2/2021,0.5487,3, noname memphis tn here we were without water for a week during an ice storm a week ago a majority black city many without electricity the city provided no help everyone was too focused on texas to care jxnneedswater
2021-03-02 17:28:35+00:00,1.3668E+18,"thread!!

please read and share! jackson mississippi (a predominantly black area) has gone without water for weeks and major news outlets are not talking about it     #JxnNeedsWater https://t.co/Tm1zS4Eh5o",noname,,5,1902,2415,11,3/2/2021,0.6571,3,thread please read and share jackson mississippi a predominantly black area has gone without water for weeks and major news outlets are not talking about it jxnneedswater 
2021-03-02 17:22:24+00:00,1.3668E+18,"wow. this is horrible 

‚ÄúFor nearly two weeks now, tens of thousands of residents of Jackson, Mississippi, have gone without running water in their homes‚Äù     #JxnNeedsWater https://t.co/O4ZW1TiTh8",noname,,8,609,1075,17,3/2/2021,0.0772,3,wow this is horrible for nearly two weeks now tens of thousands of residents of jackson mississippi have gone without running water in their homes jxnneedswater 
2021-03-02 16:39:13+00:00,1.36679E+18,"Jackson, MS doesn't have safe water. #msleg #JxnNeedsWater https://t.co/65h3xFWnWE",FBrownWilliams,"Jackson, MS",0,5,8,0,3/2/2021,-0.3412,3,jackson ms doesn t have safe water msleg jxnneedswater 
2021-03-02 14:16:29+00:00,1.36675E+18,"Meanwhile, Jackson, MS doesn't have safe water. #msleg #JxnNeedsWater https://t.co/9CUa5jmxVS",FBrownWilliams,"Jackson, MS",0,3,12,0,3/2/2021,-0.3412,3,meanwhile jackson ms doesn t have safe water msleg jxnneedswater 
2021-03-02 14:06:13+00:00,1.36675E+18,City leaders have no clue when the problem will be fixed. Residents are expected to continue their daily lives with no running water at home. They shouldn‚Äôt have to drive to a friends to take a bath. #JxnNeedsWater,AngelRMorris,,1,1,9,0,3/2/2021,-0.4588,3,city leaders have no clue when the problem will be fixed residents are expected to continue their daily lives with no running water at home they shouldn t have to drive to a friends to take a bath jxnneedswater
2021-03-02 14:04:21+00:00,1.36675E+18,"Almost three weeks later and some of my family &amp; most of the City of Jackson is still without running WATER!! The winter storm is long gone, yet this years old problem is still here. #JxnNeedsWater",AngelRMorris,,2,199,306,2,3/2/2021,-0.508,3,almost three weeks later and some of my family amp most of the city of jackson is still without running water the winter storm is long gone yet this years old problem is still here jxnneedswater
2021-03-02 13:33:09+00:00,1.36674E+18,@tatereeves should be held accountable for the reason why #JxnNeedsWater! The National and local press is being irresponsible with the lack of reporting on Reeves‚Äôs failure to enact a quicker response. This is now an environmental humanitarian crisis. #,chefcarney,"Biloxi, MS ",0,1,2,1,3/2/2021,-0.9168,3, tatereeves should be held accountable for the reason why jxnneedswater the national and local press is being irresponsible with the lack of reporting on reeves s failure to enact a quicker response this is now an environmental humanitarian crisis ntd s will be imminent 
2021-03-02 12:24:14+00:00,1.36673E+18,There are some amazing grassroots organizations working on the ground in Jackson to confront the water crisis. Please donate if you are able! #JxnNeedsWater #jxnwatercrisis https://t.co/QXaTm1N57D,educates_ms,,0,9,5,3,3/2/2021,0.1511,3,there are some amazing grassroots organizations working on the ground in jackson to confront the water crisis please donate if you are able jxnneedswater jxnwatercrisis 
2021-03-02 08:46:02+00:00,1.36667E+18,.@angiecthomas More national news about #jxnwatercrisis #JxnNeedsWater  from the Washington Post: https://t.co/VV249jIvwg,Hey_D_Ray,Instagram: Hey_D_Ray,0,0,1,0,3/2/2021,0,3, angiecthomas more national news about jxnwatercrisis jxnneedswater from the washington post 
2021-03-02 07:41:54+00:00,1.36665E+18,"#JxnNeedsWater #Mississippi #JacksonMS #Jackson #IceStorm 

good article by the ‚Å¶@washingtonpost‚Å© ... finally natl‚Äô coverage! üëÄ https://t.co/CQtkuraYmo",MrsCannonB,Mississippi ,0,0,0,0,3/2/2021,0.4926,3, jxnneedswater mississippi jacksonms jackson icestorm good article by the washingtonpost finally natl coverage 
2021-03-02 03:50:50+00:00,1.3666E+18,"Hi there national press reporting on why #JxnNeedsWater and choosing to jump on our mayor while having no such ire for Texas mayors is telling. 
Are y'all booking Tate Reeves to hold him accountable? Be sure to ask him not only about his actions now but as Lt. Gov. for 8 yrs",smartstatistic,"Jackson, MS",3,37,95,4,3/2/2021,0.0129,3,hi there national press reporting on why jxnneedswater and choosing to jump on our mayor while having no such ire for texas mayors is telling are y all booking tate reeves to hold him accountable be sure to ask him not only about his actions now but as lt gov for  yrs
2021-03-02 02:45:01+00:00,1.36658E+18,"Make a moment, please.  #JxnNeedsWater 
When I ask for direct federal oversight of infrastructure projects, I do so for reasons.  The state is not happen having Black mayors in JXN.  The state does everything possible to oppress JXN. https://t.co/RIos4aj8z4",amsmadwoman,The Happy Place,1,0,0,0,3/2/2021,0.3182,3,make a moment please jxnneedswater when i ask for direct federal oversight of infrastructure projects i do so for reasons the state is not happen having black mayors in jxn the state does everything possible to oppress jxn 
2021-03-02 01:57:22+00:00,1.36657E+18,"@limitlesspowr @wallstreetbets @WSBgod @redditinvestors @elonmusk @wsbmod @redditwsbs @reddit @reddittrading @stoolpresidente #RESURSSN√ÖLT @TaeTaenu #JxnNeedsWater #≈ΩHJ #JusticeForJohnnyDepp @CriticaSinMiedo #NoticeTurkishStudents 
„Äã„Äã„Äã #Atthis„Äã„",juhatus00,"Jeju-si, Republic of Korea",0,0,0,0,3/2/2021,0,3, limitlesspowr wallstreetbets wsbgod redditinvestors elonmusk wsbmod redditwsbs reddit reddittrading stoolpresidente resurssn lt taetaenu jxnneedswater hj justiceforjohnnydepp criticasinmiedo noticeturkishstudents atthis lenamnare 
2021-03-02 01:47:10+00:00,1.36657E+18,@thereidout @RepJayapal #JxnNeedsWater  pass the #CovidReliefBill without min wage.  Mississippians need help. The ice storm meant people with jobs couldn't work. We need help in MS. Do a stand alone bill for min wage. Stop playing games.,amsmadwoman,The Happy Place,0,0,0,0,3/2/2021,0.4588,3, thereidout repjayapal jxnneedswater pass the covidreliefbill without min wage mississippians need help the ice storm meant people with jobs couldn t work we need help in ms do a stand alone bill for min wage stop playing games 
2021-03-02 01:41:01+00:00,1.36656E+18,"https://t.co/CbONSVwdku
#JxnNeedsWater 
The state government is lax when it comes to Jackson.  The state wants to take over the city of Jackson. It has been this way since the first Black mayor. 

All of it is by design. Why I say infrastructure must be federal.",amsmadwoman,The Happy Place,0,1,2,0,3/2/2021,0,3, jxnneedswater the state government is lax when it comes to jackson the state wants to take over the city of jackson it has been this way since the first black mayor all of it is by design why i say infrastructure must be federal 
2021-03-02 01:26:00+00:00,1.36656E+18,"#JxnNeedsWater  why we must pass the bill as is.  #MinWage should be a standalone bill.  People in Jackson MS hurting, now.  Let's get #CovidRelief to the people hurting. People who have not been able to go to work and can't get UI. https://t.co/AdGwHyjhSm",amsmadwoman,The Happy Place,0,0,0,1,3/2/2021,-0.6597,3, jxnneedswater why we must pass the bill as is minwage should be a standalone bill people in jackson ms hurting now let s get covidrelief to the people hurting people who have not been able to go to work and can t get ui 
2021-03-02 00:35:55+00:00,1.36655E+18,#JxnNeedsWater #msleg https://t.co/NydLxoobCx,NotGr8flJstDead,,0,0,1,0,3/2/2021,0,3, jxnneedswater msleg 
2021-03-01 22:49:33+00:00,1.36652E+18,Thank you #JxnNeedsWater https://t.co/rMGegDYjWH,smartstatistic,"Jackson, MS",0,1,5,0,3/1/2021,0.3612,3,thank you jxnneedswater 
2021-03-01 20:26:02+00:00,1.36648E+18,"@lumumbasvision @smartstatistic &amp; her org, Mississippi Reproductive Freedom Fund (@fundMSabortions)
have been doing amazing work getting supplies to people. They do this work year round and have stepped efforts in response to increased #icestorm needs",dukejamdogmom,North America,0,1,1,0,3/1/2021,0.8779,3, lumumbasvision smartstatistic amp her org mississippi reproductive freedom fund fundmsabortions have been doing amazing work getting supplies to people they do this work year round and have stepped efforts in response to increased icestorm needs jxnneedswater 
2021-03-01 17:48:07+00:00,1.36645E+18,donate to help people in jackson ms still without water #JxnNeedsWater https://t.co/OVZ8scvt4S https://t.co/xd32uF3I3E,zrok_,oxford ms,0,1,4,0,3/1/2021,0.4019,3,donate to help people in jackson ms still without water jxnneedswater 
2021-03-01 17:41:14+00:00,1.36644E+18,"I‚Äôve highlighted the news about this here. But ICYMI, while Texas had an outage so did Jackson, MS and they are going into week three having no running water for its residents. They need the basics, below is one org that is on the ground. Please consider donating #JxnNeedsWater https://t.co/Gp0kwl0zvq",atima_omara,"Virginia, USA",0,15,8,0,3/1/2021,0.0387,3,i ve highlighted the news about this here but icymi while texas had an outage so did jackson ms and they are going into week three having no running water for its residents they need the basics below is one org that is on the ground please consider donating jxnneedswater 
2021-03-01 16:01:43+00:00,1.36642E+18,Let‚Äôs get this trending #JxnNeedsWater @AOC @yashar @Lesdoggg @OneFreshPillow @CoreyRForrester https://t.co/UKOgdHX4NT,LilPurplNickers,My own little world,0,2,1,0,3/1/2021,0,3,let s get this trending jxnneedswater aoc yashar lesdoggg onefreshpillow coreyrforrester 
2021-03-01 14:06:04+00:00,1.36639E+18,"This disaster was not the result of an unforeseeable ‚Äúact of God.‚Äù Officials have known for years that the water system was in desperate need of repair and without significant investment would collapse under the pressure of a winter storm. #JxnNeedsWater
https://t.co/VocmsX7ONa",niles_niemuth,Michigan,0,4,11,0,3/1/2021,-0.908,3,this disaster was not the result of an unforeseeable act of god officials have known for years that the water system was in desperate need of repair and without significant investment would collapse under the pressure of a winter storm jxnneedswater 
2021-03-01 12:22:12+00:00,1.36636E+18,It is confounding how the #jxnwatercrisis cannot garner national media attention. #JxnNeedsWater https://t.co/J3AI8MpeeL via @clarionledger,JohnMattFred,"Cascilla, MS",0,2,1,0,3/1/2021,0,3,it is confounding how the jxnwatercrisis cannot garner national media attention jxnneedswater via clarionledger
2021-03-01 12:15:20+00:00,1.36636E+18,#jxnwatercrisis #JxnNeedsWater https://t.co/R6MYLSbzad,JohnMattFred,"Cascilla, MS",0,0,0,0,3/1/2021,0,3, jxnwatercrisis jxnneedswater 
2021-02-28 23:31:57+00:00,1.36617E+18,#JxnNeedsWater keep making noise! https://t.co/2xIzSls192,memi_jars,,0,0,0,0,2/28/2021,0,2, jxnneedswater keep making noise 
2021-02-28 21:55:18+00:00,1.36614E+18,#JxnNeedsWater !! Thread of ways to help people in Mississippi! https://t.co/0qA6TW5egQ,601Period,"Vicksburg, MS",0,3,2,0,2/28/2021,0.5538,2, jxnneedswater thread of ways to help people in mississippi 
2021-02-28 19:51:50+00:00,1.36611E+18,"Thank you! 
It will soon be week 3 
#JxnNeedsWater https://t.co/Xiy3PovzE3",smartstatistic,"Jackson, MS",0,2,2,0,2/28/2021,0.4199,2,thank you it will soon be week  jxnneedswater 
2021-02-28 18:39:50+00:00,1.3661E+18,".@ArekiaSBennett is my eternal Miss. Black Mississippi w/ a true heart for service üòò
#JxnNeedsWater https://t.co/ITCQVGUibA",smartstatistic,"Jackson, MS",1,1,2,0,2/28/2021,0.8481,2, arekiasbennett is my eternal miss black mississippi w a true heart for service jxnneedswater 
2021-02-28 18:20:35+00:00,1.36609E+18,"Jackson, MS needs water. Here‚Äôs how you can help outüëáüèΩüëáüèΩ#JxnNeedsWater https://t.co/iDLfmjiepj",reaganschmagan,South,0,1,0,0,2/28/2021,0.4019,2,jackson ms needs water here s how you can help out jxnneedswater 
2021-02-28 18:11:39+00:00,1.36609E+18,"I've got @jerome39209 out sourcing more water and things 
I'm going to take a nap and rest my very sore arthritic hands. 
I will send updates soon 
#JxnNeedsWater",smartstatistic,"Jackson, MS",0,0,3,0,2/28/2021,-0.4201,2,i ve got  out sourcing more water and things i m going to take a nap and rest my very sore arthritic hands i will send updates soon jxnneedswater
2021-02-28 18:01:01+00:00,1.36609E+18,Predominantly Black neighborhoods in MS (shocking) don‚Äôt have potable water following the latest storm. Details in thread. #JXNneedswater https://t.co/ibsrmwPGgk,wyntermitchell,We wear masks here,0,2,6,0,2/28/2021,-0.4019,2,predominantly black neighborhoods in ms shocking don t have potable water following the latest storm details in thread jxnneedswater 
